Food Name,Protein (g),Fat (g),Carbohydrate (g),Energy (kcal) (kcal),Starch (g),Total sugars (g),Cholesterol (mg)
"Peas, mange-tout, boiled in unsalted water",3.3,0.4,4.2,32,0.5,3.7,0.0
"Peas, mange-tout, raw",3.6,0.2,4.2,32,0.8,3.4,0.0
"Peas, mange-tout, stir-fried in rapeseed oil",2.8,4.9,3.6,69,0.4,3.2,0.0
"Peas, marrowfat, canned, re-heated, drained",6.9,0.8,13.8,87,11.3,0.9,0.0
"Peas, mushy, canned, re-heated",5.8,0.7,13.8,81,10.7,1.7,0.0
"Peas, raw",6.9,1.5,11.3,83,7.0,2.3,0.0
"Peas, split, dried, boiled in unsalted water",8.3,0.9,22.7,126,21.0,0.9,0.0
"Peas, split, dried, raw",22.1,2.4,58.2,328,54.7,1.9,0.0
"Peas, sugar-snap, boiled in unsalted water",3.1,0.3,4.7,33,1.3,3.4,0.0
"Peas, sugar-snap, raw",3.4,0.2,5.0,34,1.3,3.7,0.0
"Pecan nuts, kernel only",9.2,70.1,5.8,689,1.5,4.3,0.0
"Pecan nuts, kernel only, weighed with shells",4.5,34.3,2.8,337,0.7,2.1,0.0
"Peel, mixed",0.3,0.9,  74.1,287,22.9,  51.2,0.0
"Pepper, black",10.4,3.3,N,N,Tr,0.6,0.0
"Pepper, capsicum, red, boiled in unsalted water",0.8,0.1,3.4,17,Tr,3.3,0.0
"Pepper, capsicum, red, raw",0.8,0.2,4.3,21,Tr,4.2,0.0
"Pepper, capsicum, yellow, boiled in unsalted water",0.9,0.3,5.3,26,Tr,5.1,0.0
"Pepper, capsicum, yellow, raw",0.8,0.2,4.6,23,Tr,4.4,0.0
"Pepper, cayenne, ground",12.0,17.3,31.7,318,N,N,0.0
"Pepper, white",10.4,2.1,N,N,Tr,N,0.0
"Peppermint creams, homemade",0.7,Tr,96.9,366,1.0,95.9,0.0
Peppermints,0.5,0.7,102.7,393,0.0,102.7,0.0
"Peppers, capsicum, chilli, green, raw",2.9,0.6,0.7,20,Tr,0.7,0.0
"Peppers, capsicum, chilli, red, raw",1.8,0.3,4.2,26,Tr,4.2,0.0
"Peppers, capsicum, green, boiled in unsalted water",1.0,0.5,2.6,18,0.2,2.3,0.0
"Peppers, capsicum, green, raw",0.8,0.3,2.6,15,0.1,2.4,0.0
"Peppers, green, stuffed with rice, homemade",1.7,1.9,14.4,77,8.7,5.5,0.0
"Peppers, green, stuffed with vegetables, cheese topping, homemade",2.6,5.6,5.2,80,N,N,5.5
"Peppers, stuffed with beef, rice and vegetables, homemade",6.2,4.3,9.2,99,6.5,2.5,14.9
"Pesto sauce, homemade",19.0,46.2,2.4,501,0.5,N,40.8
"Pesto, green",5.6,42.5,3.9,420,1.6,2.3,8.4
"Pesto, red",5.0,30.6,5.9,317,0.7,5.2,6.0
"Pheasant, meat only, roasted",27.9,12.0,0.0,220,0.0,0.0,220.0
"Pheasant, meat only, roasted, weighed with bone",14.5,6.2,0.0,114,0.0,0.0,115.0
"Physalis, fruit only",1.8,0.2,11.1,53,Tr,11.1,0.0
Piccalilli,1.0,0.5,17.6,84,2.8,14.8,0.0
"Pickle, sweet",0.6,0.1,28.0,111,3.4,24.6,0.0
"Pie, apple, one crust, homemade",1.8,9.2,29.0,198,11.0,18.0,0.6
"Pie, apple, pastry top and bottom, homemade",2.9,15.2,32.1,268,18.5,13.6,1.0
"Pie, apple, pastry, double crust, deep filled, retail",3.3,10.9,38.5,256,20.1,18.0,
"Pie, apple, pastry, double crust, retail",3.8,12.9,30.3,245,23.2,7.0,Tr
"Pie, apple, wholemeal, one crust, homemade",2.3,7.7,29.9,190,11.9,18.0,18.5
"Pie, apple, wholemeal, pastry top and bottom, homemade",3.6,12.7,33.6,254,19.9,13.7,31.0
"Pie, banoffee",3.8,20.0,32.9,319,11.4,20.9,N
"Pie, beef, puff or shortcrust pastry, family size, retail",8.9,13.0,18.1,220,16.8,1.2,16.3
"Pie, beef, puff or shortcrust pastry, individual, retail",9.2,17.7,25.5,292,24.3,1.2,23.8
"Pie, cheese and potato, homemade",5.0,7.2,12.6,132,11.1,1.5,37.6
"Pie, chicken and mushroom, single crust, homemade",13.6,10.4,14.3,202,10.8,2.0,36.1
"Pie, chicken, individual, baked",9.0,17.7,24.6,288,23.0,1.6,32.0
"Pie, Cottage, homemade",6.3,6.3,10.4,126,8.7,1.6,15.6
"Pie, Cottage/Shepherd's, reheated",4.5,5.4,11.9,111,10.3,1.6,16.0
"Pie, fish, white fish, homemade",8.6,2.1,12.7,101,11.2,1.5,11.3
"Pie, fish, white fish, retail, baked",6.6,4.8,14.4,124,12.7,1.8,29.0
"Pie, fruit, individual, retail",3.1,13.7,60.0,361,28.9,31.0,Tr
"Pie, fruit, one crust, homemade",2.1,9.1,26.7,190,11.0,15.7,0.6
"Pie, fruit, pastry top and bottom, blackcurrant, homemade",3.2,15.1,31.0,264,18.5,12.5,1.0
"Pie, fruit, pastry top and bottom, homemade",3.1,15.1,30.4,262,18.5,12.0,1.0
"Pie, fruit, wholemeal, one crust, homemade",2.5,7.6,27.6,182,11.9,15.8,18.5
"Pie, fruit, wholemeal, pastry top and bottom, blackcurrant, homemade",3.9,12.5,32.5,250,19.9,12.6,31.0
"Pie, fruit, wholemeal, pastry top and bottom, homemade",4.0,13.9,30.0,253,17.8,12.1,6.9
"Pie, fruit, wholemeal, with pie filling, homemade",4.0,13.6,32.7,261,24.5,8.1,33.7
"Pie, fruit, with pie filling, homemade",3.2,16.4,31.1,277,23.0,8.1,1.0
"Pie, game, homemade",12.2,22.5,34.7,381,31.2,3.4,60.0
"Pie, lemon meringue, retail",2.9,8.5,43.5,251,13.6,29.3,12.2
"Pie, lentil and cheese, homemade",11.0,9.3,14.5,182,12.3,1.5,16.1
"Pie, Quorn and vegetable",7.6,10.4,13.2,174,9.6,3.4,15.6
"Pie, spinach, homemade",6.2,13.3,8.6,177,5.9,2.6,14.4
"Pie, steak and kidney, double crust, homemade",14.6,18.1,22.2,305,21.2,0.9,81.6
"Pie, steak and kidney, single crust, homemade",17.0,13.1,15.3,243,14.7,0.6,106.6
"Pie, turkey, single crust, homemade",13.8,10.4,14.9,205,11.1,2.4,40.7
"Pie, vegetable, homemade",2.9,9.4,17.1,160,15.9,2.8,0.6
"Pie, vegetable, wholemeal, homemade",3.4,7.8,18.0,151,13.2,3.0,18.9
"Pigeon, meat only, roasted",29.0,7.9,0.0,187,0.0,0.0,N
"Pigeon, meat only, roasted, weighed with bone",13.6,3.7,0.0,88,0.0,0.0,N
"Pilaf, rice with spinach, homemade",3.7,1.9,17.8,104,15.7,1.6,0.0
"Pilaf, rice with tomato, homemade",2.9,2.6,27.9,147,26.8,0.9,0.0
"Pilau, egg and potato, brown rice, homemade",4.7,2.8,19.5,117,18.9,1.6,57.0
"Pilau, egg and potato, homemade",4.4,2.5,22.4,124,18.5,1.4,56.9
"Pilau, mushroom, homemade",2.5,3.5,23.9,138,22.9,0.8,8.2
"Pilau, prawn, homemade",5.2,3.2,24.8,149,23.7,0.8,30.4
"Pilau, vegetable, homemade",3.3,1.5,22.6,112,22.3,0.3,4.0
"Pine nuts, kernel only",14.0,68.6,4.0,688,0.1,3.9,0.0
"Pineapple juice, unsweetened",0.3,0.1,10.5,41,0.0,10.5,0.0
"Pineapple, canned in juice, whole contents",0.3,Tr,12.2,47,0.0,12.2,0.0
"Pineapple, canned in syrup, whole contents",0.5,Tr,16.5,64,0.0,16.5,0.0
"Pineapple, dried",3.3,0.7,75.7,303,0.0,75.7,0.0
"Pineapple, flesh only, raw",0.5,0.1,11.4,45,0.0,11.4,0.0
"Pineapple, flesh only, raw, weighed with skin and top",0.2,0.1,5.0,20,0.0,5.0,0.0
"Pinni, homemade",5.4,31.4,59.5,527,18.5,40.9,62.8
"Pistachio nuts, kernel only, roasted and salted",17.9,55.4,8.2,601,2.5,5.7,0.0
"Pistachio nuts, kernel only, roasted and salted, weighed with shells",9.9,30.5,4.6,331,1.4,3.2,0.0
"Pizza base, raw",7.8,4.8,57.5,290,54.1,3.4,N
"Pizza, cheese and tomato, retail",12.2,9.8,36.1,272,32.2,3.9,19.1
"Pizza, chicken topped, retail",13.4,8.3,31.3,246,29.2,2.1,N
"Pizza, fish topped, takeaway",13.3,7.5,28.0,226,26.2,2.0,25.4
"Pizza, ham and pineapple, retail",13.5,8.6,34.4,260,31.3,3.1,N
"Pizza, meat topped, retail and takeaway",13.2,10.3,29.1,255,27.3,1.8,19.3
"Pizza, tomato, homemade",3.3,10.6,22.6,193,19.6,3.0,0.0
"Pizza, vegetarian, retail and takeaway",10.8,6.9,29.6,216,26.9,2.4,N
"Plaice, flesh only, baked",21.3,1.6,0.0,99,0.0,0.0,85.7
"Plaice, flesh only, raw",16.4,1.2,0.0,76,0.0,0.0,66.0
"Plaice, flesh only, steamed",19.5,1.4,0.0,91,0.0,0.0,78.5
"Plaice, flesh only, steamed, fillets weighed with bones and skin",14.5,1.1,0.0,68,0.0,0.0,58.4
"Plaice, in batter, fried in blended oil",15.2,16.8,12.0,257,12.0,Tr,N
"Plaice, in batter, fried in retail blend oil",15.2,16.8,12.0,257,12.0,Tr,60.0
"Plaice, in batter, fried in sunflower oil",15.2,16.8,12.0,257,12.0,Tr,60.0
"Plaice, in breadcrumbs, baked",14.4,11.6,21.5,243,20.2,1.3,39.0
"Plantain, boiled in unsalted water, flesh only",0.8,0.2,28.5,112,23.0,5.5,0.0
"Plantain, green flesh, raw",1.1,0.3,29.4,117,23.7,5.7,0.0
"Plantain, ripe, fried in rapeseed oil",1.5,9.2,47.5,267,36.0,11.5,0.0
"Plums, average, flesh and skin, stewed with sugar, weighed with stones",0.5,0.1,17.0,67,0.0,17.0,0.0
"Plums, average, flesh and skin, stewed without sugar",0.5,0.1,7.3,30,0.0,7.3,0.0
"Plums, average, flesh and skin, stewed without sugar, weighed with stones",0.5,0.1,6.9,29,0.0,6.9,0.0
"Plums, average, stewed with sugar, flesh and skin",0.5,0.1,17.9,70,0.0,17.9,0.0
"Plums, dessert, flesh and skin, raw",0.6,0.3,9.7,41,0.0,9.7,0.0
"Plums, dessert, flesh and skin, raw, weighed with stones",0.6,0.2,9.4,40,0.0,9.4,0.0
"Plums, Victoria, flesh and skin, raw",0.6,0.1,9.6,39,0.0,9.6,0.0
"Plums, Victoria, flesh and skin, raw, weighed with stones",0.5,0.1,9.0,37,0.0,9.0,0.0
"Plums, Victoria, stewed without sugar",0.5,0.1,8.3,34,0.0,8.3,0.0
"Plums, Victoria, stewed without sugar, weighed with stones",0.5,0.1,7.9,33,0.0,7.9,0.0
"Plums, yellow, flesh and skin, raw",0.5,0.1,5.9,25,0.0,5.9,0.0
"Plums, yellow, flesh and skin, raw, weighed with stones",0.5,0.1,5.7,24,0.0,5.7,0.0
"Polenta, hydrated, raw",1.9,0.4,15.2,68,15.2,Tr,0.0
"Pollock, Alaskan, flesh only, baked",28.2,1.2,0.0,124,0.0,0.0,84.5
"Pollock, Alaskan, flesh only, raw",16.4,0.7,0.0,72,0.0,0.0,49.0
"Pollock, Alaskan, flesh only, steamed",27.4,1.2,0.0,120,0.0,0.0,82.1
Pomegranate juice drink,0.2,Tr,11.6,44,0.0,11.6,0.0
"Pomegranate, flesh and pips",1.3,0.2,11.8,51,0.0,11.8,0.0
"Pomegranate, flesh and pips, weighed with skin",0.9,0.1,7.7,33,0.0,7.7,0.0
"Pomelo, flesh only",0.6,0.2,6.8,30,0.0,6.8,0.0
"Pomelo, flesh only, weighed with peel and pips",0.4,0.1,4.1,18,0.0,4.1,0.0
"Pomfret, black, raw",18.8,2.6,0.0,99,0.0,0.0,N
"Pomfret, white, raw",18.3,2.1,0.0,92,0.0,0.0,N
"Popcorn, candied",6.9,23.8,60.7,469,45.7,15.0,0.0
"Popcorn, salted, retail",9.0,23.5,59.3,470,58.7,0.6,0.0
Poppy seeds,20.6,47.1,N,N,N,N,0.0
"Pork chops in mustard and cream, homemade",15.5,19.4,1.0,263,Tr,1.0,56.1
"Pork chops in mustard and cream, homemade, weighed with bone",13.6,17.0,0.9,230,Tr,0.9,49.2
"Pork pie, individual",9.9,26.0,25.7,370,24.2,1.5,34.7
Pork scratchings,47.9,46.0,0.2,606,Tr,0.2,129.2
"Pork, belly joint, roasted, lean and fat",25.1,21.4,0.0,293,0.0,0.0,85.0
"Pork, belly joint/slices, grilled, lean and fat",27.4,23.4,0.0,320,0.0,0.0,97.0
"Pork, belly joint/slices, raw, lean and fat",19.1,20.2,0.0,258,0.0,0.0,71.0
"Pork, belly joint/slices, raw, lean and fat, weighed with bone",17.6,18.6,0.0,238,0.0,0.0,65.0
"Pork, crackling, cooked",36.2,45.0,0.0,550,0.0,0.0,105.0
"Pork, diced, casseroled, lean",36.8,5.3,0.0,195,0.0,0.0,106.5
"Pork, diced, casseroled, lean and fat",36.3,6.4,0.0,203,0.0,0.0,106.0
"Pork, diced, kebabs, grilled, lean",37.9,5.4,0.0,200,0.0,0.0,109.9
"Pork, diced, kebabs, grilled, lean and fat",37.4,6.5,0.0,208,0.0,0.0,109.3
"Pork, diced, raw, lean",23.1,3.3,0.0,122,0.0,0.0,67.0
"Pork, diced, raw, lean and fat",22.8,4.5,0.0,132,0.0,0.0,67.4
"Pork, fat, average, cooked",14.2,50.9,0.0,515,0.0,0.0,98.0
"Pork, fat, average, raw",10.1,56.4,0.0,548,0.0,0.0,71.0
"Pork, fillet medallions, grilled lean",36.3,0.8,0.0,152,0.0,0.0,101.9
"Pork, fillet medallions, grilled, lean and fat",35.9,1.9,0.0,161,0.0,0.0,101.1
"Pork, fillet medallions, raw, lean",22.8,0.5,0.0,96,0.0,0.0,64.1
"Pork, fillet medallions, raw, lean and fat",22.6,1.8,0.0,106,0.0,0.0,64.0
"Pork, fillet strips, stir-fried in rapeseed oil, lean",35.8,2.7,0.0,168,0.0,0.0,100.5
"Pork, hand, shoulder joint, raw, lean",20.8,4.2,0.0,121,0.0,0.0,64.0
"Pork, hand, shoulder joint, raw, lean and fat",18.1,16.2,0.0,218,0.0,0.0,68.0
"Pork, hand, shoulder joint, roasted, lean",30.8,8.8,0.0,202,0.0,0.0,105.0
"Pork, hand, shoulder joint, roasted, lean and fat",27.5,16.5,0.0,259,0.0,0.0,105.0
"Pork, lean, average, raw",22.2,3.1,0.0,116,0.0,0.0,65.1
"Pork, leg joint, raw, lean",23.1,3.3,0.0,122,0.0,0.0,66.5
"Pork, leg joint, raw, lean and fat",19.9,15.0,0.0,215,0.0,0.0,70.9
"Pork, leg joint, raw, lean and fat, trimmed",22.4,5.8,0.0,142,0.0,0.0,67.8
"Pork, leg joint, roasted, lean and fat",29.6,15.9,0.0,261,0.0,0.0,92.4
"Pork, leg joint, roasted, lean and fat, trimmed",32.5,8.1,0.0,203,0.0,0.0,94.4
"Pork, leg joint, roasted, lean",33.3,5.9,0.0,186,0.0,0.0,95.4
"Pork, loin chops, grilled, lean",35.1,5.9,0.0,194,0.0,0.0,89.0
"Pork, loin chops, grilled, lean and fat",33.3,11.5,0.0,237,0.0,0.0,85.9
"Pork, loin chops, raw, lean and fat",21.3,11.7,0.0,191,0.0,0.0,63.2
"Pork, loin chops, raw, lean and fat, weighed with bone",18.1,10.0,0.0,162,0.0,0.0,53.7
"Pork, loin chops, roasted, lean",39.6,4.2,0.0,196,0.0,0.0,152.2
"Pork, loin chops, roasted, lean and fat",36.2,11.4,0.0,247,0.0,0.0,142.9
"Pork, loin chops, roasted, lean and fat, weighed with bone",27.9,8.8,0.0,191,0.0,0.0,110.0
"Pork, loin medallions, raw, lean",24.8,1.9,0.0,116,0.0,0.0,58.4
"Pork, loin medallions, raw, lean and fat",23.0,5.4,0.0,141,0.0,0.0,58.4
"Pork, loin medallions, raw, lean and fat, trimmed",23.4,3.1,0.0,122,0.0,0.0,58.1
"Pork, loin steaks, fried in rapeseed oil, lean",33.9,4.7,0.0,178,0.0,0.0,92.3
"Pork, loin steaks, fried in rapeseed oil, lean and fat",31.7,12.0,0.0,235,0.0,0.0,87.9
"Pork, loin steaks, grilled, lean",35.1,5.9,0.0,194,0.0,0.0,89.0
"Pork, loin steaks, grilled, lean and fat",32.7,12.9,0.0,247,0.0,0.0,85.1
"Pork, loin steaks, grilled, lean and fat, trimmed",34.4,8.0,0.0,210,0.0,0.0,87.9
"Pork, loin steaks, raw, lean",23.2,1.9,0.0,110,0.0,0.0,63.2
"Pork, loin steaks, raw, lean and fat",21.4,11.2,0.0,187,0.0,0.0,63.0
"Pork, loin steaks, raw, lean and fat, trimmed",22.5,5.5,0.0,140,0.0,0.0,63.1
"Pork, loin steaks, stewed, lean",33.2,2.7,0.0,157,0.0,0.0,90.1
"Pork, loin steaks, stewed, lean and fat",31.3,9.7,0.0,212,0.0,0.0,86.3
"Pork, mince, raw",19.2,9.7,0.0,164,0.0,0.0,66.0
"Pork, mince, stewed",24.4,10.4,0.0,191,0.0,0.0,81.0
"Pork, shoulder chops (collar), braised, lean",30.5,10.1,0.0,213,0.0,0.0,98.0
"Pork, shoulder chops (collar), braised, lean and fat",28.1,15.0,0.0,247,0.0,0.0,97.0
"Pork, shoulder chops (collar), braised, lean and fat, weighed with bone",21.6,11.5,0.0,190,0.0,0.0,75.0
"Pork, shoulder chops (collar), raw, lean and fat",18.5,12.4,0.0,186,0.0,0.0,67.0
"Pork, shoulder chops (collar), raw, lean and fat, weighed with bone",14.6,9.8,0.0,147,0.0,0.0,53.0
"Pork, shoulder joint (collar), pot-roasted, lean",30.0,9.0,0.0,201,0.0,0.0,92.0
"Pork, shoulder joint (collar), pot-roasted, lean and fat",24.4,18.0,0.0,260,0.0,0.0,92.0
"Pork, shoulder joint (collar), raw, lean and fat",17.6,16.4,0.0,218,0.0,0.0,68.0
"Pork, shoulder joint (collar), raw, lean and fat, weighed with bone",13.1,12.1,0.0,161,0.0,0.0,50.0
"Pork, shoulder steaks (collar), grilled, lean and fat",29.2,19.5,0.0,292,0.0,0.0,115.0
"Pork, shoulder steaks (collar), grilled, lean and fat, weighed with bone",13.1,8.8,0.0,132,0.0,0.0,55.0
"Pork, shoulder steaks (collar), raw, lean and fat",18.7,10.4,0.0,168,0.0,0.0,66.0
"Pork, shoulder steaks (collar), raw, lean and fat, weighed with bone",9.0,6.4,0.0,94,0.0,0.0,31.0
"Pork, spare ribs, 'barbecue style', homemade",20.8,22.3,4.9,302,0.6,5.0,69.7
"Pork, spare ribs, 'barbecue style', homemade, weighed with bone",9.7,10.4,2.3,142,0.3,2.3,31.8
"Pork, spare ribs, 'barbecue style', meat only, retail, reheated, weighed with bone",9.2,6.0,2.0,98,0.5,1.5,57.0
"Pork, spare ribs, 'barbecue style', meat only, retail, reheated",26.3,17.1,5.8,281,1.4,4.4,160.0
"Pork, spare ribs, Chinese barbecue, takeaway",22.1,18.7,,,,,
"Pork, spare ribs, in black bean sauce, meat and sauce only, homemade",14.3,14.5,5.8,216,0.7,5.1,46.0
"Pork, spare ribs, in black bean sauce, meat and sauce only, homemade, weighed with bone",8.2,8.2,3.3,123,0.4,2.9,25.7
"Pork, spare ribs, raw, lean and fat",18.7,13.4,0.0,195,0.0,0.0,66.0
"Pork, stir-fried with vegetables, homemade",16.4,2.9,2.6,103,1.4,1.2,44.0
"Pork, sweet and sour, made with lean pork, homemade",14.5,6.3,11.0,162,3.5,7.2,51.8
"Pork, sweet and sour, made with sweet and sour cook in sauce",15.3,4.9,11.4,148,1.4,10.0,45.5
"Pork, trotters and tails, boiled with added salt",19.8,22.3,0.0,280,0.0,0.0,N
"Porridge oats, unfortified",10.9,8.1,70.7,381,70.4,0.3,0.3
"Porridge oats, unfortified, cooked, made up with semi-skimmed milk",4.6,2.3,12.1,84,8.0,4.1,2.7
"Porridge, made with milk and water",3.1,1.9,11.2,72,8.8,2.5,3.1
"Porridge, made with water",1.4,1.0,8.8,47,8.8,Tr,0.0
"Porridge, made with whole milk",4.9,4.7,13.3,112,8.5,4.8,12.5
Port,0.1,0.0,12.0,157,0.0,12.0,0.0
Pot savouries,11.6,10.9,58.8,365,46.9,8.2,0.0
"Pot savouries, made up",3.3,3.1,16.7,103,13.3,2.3,0.0
"Potato cakes, fried in rapeseed oil",3.9,8.4,31.4,210,31.5,1.1,5.3
"Potato chips, crinkle cut, frozen, fried in corn oil",3.6,16.7,33.4,290,32.5,0.9,0.0
"Potato chips, fine cut, from fast food outlets",3.5,14.2,39.7,290,39.4,0.3,Tr
"Potato chips, fine cut, frozen, fried in blended vegetable oil",4.5,21.3,41.2,364,40.6,0.6,0.0
"Potato chips, fine cut, frozen, fried in corn oil",4.5,21.3,41.2,364,40.6,0.6,0.0
"Potato chips, fine cut, frozen, fried in dripping",4.5,21.3,41.2,364,40.6,0.6,19.0
"Potato chips, fried in beef dripping, from takeaway fish and chip shops",3.5,8.4,33.2,214,32.7,0.6,11.0
"Potato chips, fried in commercial oil, from takeaway fish and chip shops",3.5,8.4,33.2,214,32.7,0.6,0.9
"Potato chips, fried in palm oil, from takeaway fish and chip shops",3.5,8.4,33.2,214,32.7,0.6,0.9
"Potato chips, fried in rapeseed oil, from takeaway fish and chip shops",3.5,8.4,33.2,214,32.7,0.6,0.0
"Potato chips, homemade, fried in corn oil",3.2,6.7,33.1,197,31.6,1.5,0.0
"Potato chips, homemade, fried in dripping",3.2,6.7,33.1,197,31.6,1.5,12.5
"Potato chips, homemade, fried in rapeseed oil",3.6,6.7,34.1,202,33.2,0.9,0.0
"Potato chips, homemade, fried in sunflower oil",3.2,6.7,33.1,197,31.6,1.5,0.0
"Potato chips, microwave, cooked",3.6,9.6,32.1,221,31.5,0.6,0.0
"Potato chips, oven ready, no batter, baked",3.2,4.9,35.3,189,34.3,1.0,0.0
"Potato chips, oven ready, with batter, baked",3.4,6.1,35.6,202,35.2,0.4,Tr
"Potato chips, straight cut, frozen, fried in blended oil",4.1,13.5,36.0,273,35.3,0.7,0.0
"Potato chips, straight cut, frozen, fried in corn oil",4.1,13.5,36.0,273,35.3,0.7,0.0
"Potato chips, straight cut, frozen, fried in dripping",4.1,13.5,36.0,273,35.3,0.7,12.0
"Potato chips, thick cut, frozen, fried in corn oil",3.6,10.2,34.0,234,33.2,0.8,0.0
"Potato crisps, fried in sunflower oil",6.2,28.8,55.8,493,54.9,0.9,0.0
"Potato crisps, low fat",6.6,21.5,63.5,458,62.0,1.5,0.0
"Potato croquettes, fried in blended oil",3.7,13.1,21.6,214,21.1,0.5,0.0
"Potato powder, instant, made up with semi-skimmed milk",2.4,0.5,14.2,67,12.7,1.5,2.0
"Potato powder, instant, made up with skimmed milk",2.4,0.1,14.2,66,12.7,1.5,Tr
"Potato powder, instant, made up with water",1.5,0.1,13.5,57,12.7,0.7,0.0
"Potato powder, instant, made up with whole milk",2.4,1.2,14.8,76,12.7,2.0,Tr
"Potato powder, instant, raw",8.4,0.6,74.9,320,70.8,4.1,0.0
"Potato products, shaped, frozen, baked",2.5,8.3,28.1,190,27.7,0.4,0.0
Potato rings,3.6,22.4,70.5,480,70.2,0.3,0.0
"Potato snacks, pringle-type, fried in vegetable oil",4.3,31.8,57.4,519,55.9,1.5,0.0
"Potato wedges, retail, cooked",2.8,5.5,30.6,176,29.7,0.8,0.0
"Potato, leek and celery bake",4.4,6.5,12.6,122,10.8,1.6,17.0
"Potatoes with onions and eggs, fried",7.8,23.8,19.1,316,17.3,1.4,172.0
"Potatoes, duchesse",3.1,5.1,17.5,124,16.7,0.8,45.6
"Potatoes, new and salad, boiled in salted water, flesh and skin",1.8,0.1,14.9,68,13.8,1.1,0.0
"Potatoes, new and salad, boiled in unsalted water, flesh and skin",1.8,0.1,14.9,68,13.8,1.1,0.0
"Potatoes, new and salad, flesh only, raw",1.7,0.1,16.1,68,14.8,1.3,0.0
"Potatoes, new, frozen, `roast' in corn oil",2.5,6.6,23.4,157,22.4,1.0,0.0
"Potatoes, old, baked, flesh and skin",2.5,0.2,22.6,97,21.2,1.4,0.0
"Potatoes, old, baked, flesh only",2.2,0.1,18.0,77,17.3,0.7,0.0
"Potatoes, old, baked, flesh only, weighed with skin",1.5,0.1,12.1,52,11.6,0.5,0.0
"Potatoes, old, boiled in salted water, flesh only",1.8,0.1,17.5,74,16.7,0.8,0.0
"Potatoes, old, boiled in unsalted water, flesh only",1.8,0.1,17.5,74,16.7,0.8,0.0
"Potatoes, old, mashed with butter",1.9,3.9,15.9,102,14.9,1.0,9.9
"Potatoes, old, mashed with reduced fat spread",1.8,2.8,15.9,93,14.9,1.0,0.4
"Potatoes, old, microwaved, flesh and skin",2.6,0.1,21.5,92,19.4,2.1,0.0
"Potatoes, old, potato wedges, with skin, cooked in sunflower oil, homemade",2.9,3.8,26.5,145,24.8,1.7,0.0
"Potatoes, old, raw, flesh only",1.9,0.1,19.6,82,18.7,0.9,0.0
"Potatoes, old, roasted in corn oil",2.6,5.7,26.4,161,25.2,1.2,0.0
"Potatoes, old, roasted in lard",2.6,5.7,26.4,161,25.2,1.2,5.2
"Potatoes, old, roasted in rapeseed oil",2.6,5.7,26.4,161,25.2,1.2,0.0
"Potatoes, old, roasted in sunflower oil, flesh only",2.6,5.7,26.4,161,25.2,1.2,0.0
"Potatoes, old, wedges, with skin, homemade, cooked in rapeseed oil",2.9,3.8,26.5,145,24.8,1.7,0.0
"Poussin, raw, meat and skin",19.1,13.9,0.0,202,0.0,0.0,100.0
"Poussin, raw, meat and skin, weighed with bone",11.1,8.1,0.0,117,0.0,0.0,58.0
"Prawn crackers, takeaway",0.3,39.0,58.2,570,56.0,2.2,0.3
"Prawns, king, grilled from raw",23.5,0.9,0.0,102,0.0,0.0,193.0
"Prawns, king, purchased cooked",16.2,0.4,0.0,68,0.0,0.0,162.0
"Prawns, king, purchased cooked, weighed with shells",8.7,0.2,0.0,37,0.0,0.0,87.4
"Prawns, king, raw",17.6,0.7,0.0,77,0.0,0.0,150.0
"Prawns, standard, dried",83.1,4.9,0.0,377,0.0,0.0,770.2
"Prawns, standard, purchased cooked",15.4,0.9,0.0,70,0.0,0.0,143.0
Pre-mixed spirit based drinks,Tr,0.0,8.0,52,0.0,8.0,0.0
"Prickly pears, flesh and seeds",0.7,0.3,11.5,49,0.0,11.5,0.0
"Profiteroles with sauce, frozen",5.5,25.7,24.6,346,6.4,17.0,N
Prune juice,0.5,0.1,14.4,57,0.0,14.4,0.0
"Prunes, canned in juice, whole contents",0.7,0.2,19.7,79,0.0,19.7,0.0
"Prunes, flesh and skin",2.8,0.5,38.4,160,0.0,38.4,0.0
"Prunes, flesh and skin, stewed with sugar",1.3,0.2,25.5,103,0.0,25.5,0.0
"Prunes, flesh and skin, stewed with sugar, weighed with stones",1.2,0.2,23.5,95,0.0,23.5,0.0
"Prunes, flesh and skin, stewed without sugar",1.4,0.3,19.5,81,0.0,19.5,0.0
"Prunes, flesh and skin, stewed without sugar, weighed with stones",1.3,0.2,17.8,74,0.0,17.8,0.0
"Prunes, flesh and skin, weighed with stones",2.4,0.4,32.3,134,0.0,32.3,0.0
"Prunes, ready-to-eat, semi-dried",2.3,0.3,36.5,149,0.0,36.5,0.0
"Prunes, ready-to-eat, semi-dried, weighed with stones",2.0,0.3,31.4,128,0.0,31.4,0.0
"Pudding, bread and butter, homemade",6.3,5.3,17.0,137,4.6,12.4,68.7
"Pudding, Christmas, homemade",5.0,9.8,54.6,316,20.8,33.8,41.2
"Pudding, Christmas, retail",3.0,6.9,56.3,285,10.1,46.2,36.0
"Pudding, Eve's pudding, homemade",3.3,13.4,31.4,252,11.4,20.0,80.4
"Pudding, Queen of Puddings, homemade",5.0,7.6,34.2,195,6.8,27.5,81.4
"Pudding, rice, canned",3.3,1.3,16.1,85,7.3,8.7,9.0
"Pudding, rice, canned, low fat",3.5,0.8,16.0,81,7.2,8.7,N
"Pudding, rice, homemade, with semi-skimmed milk",4.2,4.4,19.0,127,8.7,10.3,12.7
"Pudding, rice, homemade, with skimmed milk",4.3,2.9,19.1,114,8.7,10.4,10.4
"Pudding, rice, homemade, with whole milk",4.2,6.5,18.9,145,8.7,10.2,19.1
"Pudding, sponge, canned",3.1,9.1,45.4,265,19.6,25.8,32.0
"Pudding, sponge, homemade",5.7,14.6,46.2,327,27.7,18.5,61.8
"Pudding, sponge, with dried fruit, homemade",5.5,13.4,50.5,332,25.3,25.2,56.5
"Pudding, sponge, with jam or treacle, homemade",5.3,13.3,51.1,333,25.3,25.8,56.5
"Pudding, spotted dick, homemade",4.5,16.1,48.3,344,29.2,19.1,15.8
"Pudding, suet, homemade",4.8,17.6,46.4,352,31.9,14.5,17.4
Pumpkin seeds,24.4,45.6,15.2,565,14.1,1.1,0.0
"Pumpkin, flesh only, boiled in unsalted water",0.6,0.3,1.9,12,0.1,1.8,0.0
"Pumpkin, flesh only, raw",0.7,0.2,2.2,13,0.3,1.7,0.0
"Puri, homemade",7.2,22.3,36.5,366,35.3,1.2,29.7
"Quiche, cheese and egg, homemade",12.5,22.3,14.6,305,13.1,1.6,116.0
"Quiche, cheese and egg, wholemeal, homemade",13.0,20.4,15.6,294,14.0,1.6,137.1
"Quiche, Lorraine, homemade",15.3,26.0,16.8,358,14.6,2.2,102.9
"Quiche, Lorraine, shortcrust pastry, retail",9.1,17.6,19.7,269,16.5,3.2,79.6
"Quiche, Lorraine, wholemeal pastry, homemade",15.8,24.9,18.0,354,15.8,2.2,129.7
"Quiche, mushroom, homemade",9.9,20.0,15.5,278,14.2,1.3,84.2
"Quiche, mushroom, wholemeal, homemade",10.5,18.1,16.6,267,15.3,1.3,107.3
"Quiche, vegetable, retail",8.1,19.7,21.2,289,17.5,3.5,82.6
"Quinces, flesh only",0.3,0.1,6.3,26,Tr,6.3,0.0
"Quinoa, raw",13.8,5.0,55.7,309,47.6,6.1,0.0
Quorn korma,3.7,7.0,16.7,140,15.0,1.3,2.0
"Quorn, pieces, as purchased",14.0,1.4,1.1,73,0.7,0.4,0.0
"Rabbit, raw, meat only",21.9,5.5,0.0,137,0.0,0.0,53.0
"Rabbit, stewed, meat only",21.2,3.2,0.0,114,0.0,0.0,49.0
"Rabbit, stewed, meat only, weighed with bone",12.7,1.9,0.0,68,0.0,0.0,49.0
"Raddiccio, raw",1.4,0.2,1.7,14,Tr,1.7,0.0
"Radish leaves, raw",3.5,0.5,3.5,33,N,N,0.0
"Radish, red, flesh and skin, raw",0.7,0.4,1.4,12,Tr,1.4,0.0
"Radish, white/mooli, raw",0.8,0.1,2.9,15,Tr,2.9,0.0
"Raisins, dried",3.0,1.0,62.6,256,0.0,62.6,0.0
"Raita, homemade",4.4,2.4,5.8,57,0.0,5.8,7.5
"Raita, yogurt and gram flour, homemade",3.3,6.6,8.1,103,1.8,5.3,15.3
"Rambutan, flesh only",1.0,0.4,16.3,69,0.0,16.3,0.0
"Rape leaves, raw",3.8,0.3,4.8,37,N,N,0.0
"Raspberries, raw",0.8,0.3,5.1,25,0.0,5.1,0.0
"Raspberries, stewed with sugar",1.2,0.3,15.0,63,0.0,15.0,0.0
"Raspberries, stewed without sugar",1.4,0.3,4.4,24,0.0,4.4,0.0
"Ratatouille, homemade",1.2,7.0,3.8,82,0.2,3.3,0.0
Red pea loaf,9.2,3.4,15.6,127,13.0,0.9,36.9
"Red rice, boiled in unsalted water",3.0,1.2,28.2,129,28.1,0.2,0.1
"Red snapper, flesh only, fried in blended oil, weighed with bones and skin",24.5,3.1,0.0,126,0.0,0.0,46.0
"Red snapper, flesh only, fried in blended oil, weighed with bones and skin",12.5,1.6,0.0,64,0.0,0.0,23.0
"Red snapper, flesh only, fried in sunflower oil",24.5,3.1,0.0,126,0.0,0.0,46.0
"Red snapper, flesh only, fried in sunflower oil, weighed with bones and skin",12.5,1.6,0.0,64,0.0,0.0,23.0
"Red snapper, flesh only, raw",19.6,1.3,0.0,90,0.0,0.0,37.0
"Redcurrants, raw",1.1,Tr,4.4,21,0.0,4.4,0.0
"Redcurrants, stewed with sugar",0.9,Tr,13.3,53,0.0,13.3,0.0
"Redcurrants, stewed without sugar",0.9,Tr,3.8,17,0.0,3.8,0.0
"Redfish, raw",18.4,2.7,0.0,98,0.0,0.0,42.0
Re-fried beans,7.1,8.6,15.0,169,11.9,1.4,1.0
"Relish, corn/cucumber/onion",1.0,0.3,  36.6,144,7.7,  28.9,0.0
"Relish, tomato based",1.2,0.1,27.6,114,2.5,25.1,0.0
"Rhubarb, stems only, raw",0.9,0.1,0.8,7,0.0,0.8,0.0
"Rhubarb, stems only, stewed with sugar",0.9,0.1,11.5,48,0.0,11.5,0.0
"Rhubarb, stems only, stewed without sugar",1.0,0.6,1.2,14,0.0,1.2,0.0
Rice and black-eye beans,5.6,2.2,34.1,170,32.7,0.9,0.2
"Rice and black-eye beans, brown rice",5.9,2.4,31.6,164,31.0,1.0,0.2
Rice and pigeon peas,4.9,2.2,33.1,163,32.3,0.7,0.2
"Rice and pigeon peas, brown rice",5.2,2.3,30.8,157,30.6,0.8,0.2
