Food Name,Protein (g),Fat (g),Carbohydrate (g),Energy (kcal) (kcal),Starch (g),Total sugars (g),Cholesterol (mg)
"Chicken soup, cream of, canned, condensed, as served",1.3,2.9,3.0,43,2.3,0.7,2.0, "Poultry"
"Chicken wings, marinated, meat and skin, barbecued",27.4,16.6,4.1,274,0.5,3.6,120.0, "Poultry"
"Chicken wings, marinated, meat and skin, barbecued, weighed with bone",17.8,10.8,2.7,179,0.3,2.3,78.0, "Poultry"
"Chicken, breast, casseroled, meat and skin",26.9,8.5,0.0,184,0.0,0.0,92.0, "Poultry"
"Chicken, breast, casseroled, meat and skin, weighed with bone",24.2,7.6,0.0,165,0.0,0.0,83.0, "Poultry"
"Chicken, breast, casseroled, meat only",28.4,5.2,0.0,160,0.0,0.0,90.0, "Poultry"
"Chicken, breast, grilled with skin, meat only",29.8,3.1,0.0,147,0.0,0.0,84.0, "Poultry"
"Chicken, breast, grilled without skin, meat only",32.0,2.2,0.0,148,0.0,0.0,94.0, "Poultry"
"Chicken, breast, grilled, meat and skin",28.9,6.4,0.0,173,0.0,0.0,90.0, "Poultry"
"Chicken, breast, strips, stir-fried in corn oil",29.7,4.6,0.0,161,0.0,0.0,87.0, "Poultry"
"Chicken, corn-fed, raw, dark meat only",19.5,7.2,0.0,143,0.0,0.0,100.0, "Poultry"
"Chicken, corn-fed, raw, light meat only",23.0,2.8,0.0,118,0.0,0.0,70.0, "Poultry"
"Chicken, corn-fed, raw, meat only",21.4,4.8,0.0,129,0.0,0.0,85.0, "Poultry"
"Chicken, corn-fed, raw, skin only",10.1,52.7,0.0,514,0.0,0.0,140.0, "Poultry"
"Chicken, corn-fed, roasted, dark meat only",24.0,9.8,0.0,185,0.0,0.0,120.0, "Poultry"
"Chicken, corn-fed, roasted, light meat only",25.8,4.2,0.0,141,0.0,0.0,76.0, "Poultry"
"Chicken, corn-fed, roasted, meat only",24.9,7.2,0.0,164,0.0,0.0,99.0, "Poultry"
"Chicken, dark meat, raw",20.9,2.8,0.0,109,0.0,0.0,105.0, "Poultry"
"Chicken, dark meat, roasted",24.4,10.9,0.0,196,0.0,0.0,120.0, "Poultry"
"Chicken, drumsticks, casseroled, meat and skin",22.3,14.2,0.0,217,0.0,0.0,125.0, "Poultry"
"Chicken, drumsticks, casseroled, meat and skin, weighed with bone",14.5,9.2,0.0,141,0.0,0.0,80.0, "Poultry"
"Chicken, drumsticks, casseroled, meat only",24.3,9.7,0.0,185,0.0,0.0,135.0, "Poultry"
"Chicken, drumsticks, roasted, meat and skin",25.8,9.1,0.0,185,0.0,0.0,135.0, "Poultry"
"Chicken, drumsticks, roasted, meat and skin, weighed with bone",16.2,5.7,0.0,116,0.0,0.0,86.0, "Poultry"
"Chicken, drumsticks, roasted, meat only",26.6,5.1,0.0,152,0.0,0.0,135.0, "Poultry"
"Chicken, leg quarter, casseroled, meat and skin",22.9,13.9,0.0,217,0.0,0.0,115.0, "Poultry"
"Chicken, leg quarter, casseroled, meat and skin, weighed with bone",14.4,8.8,0.0,137,0.0,0.0,72.0, "Poultry"
"Chicken, leg quarter, casseroled, meat only",25.0,8.4,0.0,176,0.0,0.0,115.0, "Poultry"
"Chicken, leg quarter, raw, meat and skin",18.3,13.3,0.0,193,0.0,0.0,110.0, "Poultry"
"Chicken, leg quarter, raw, meat and skin, weighed with bone",12.6,9.2,0.0,133,0.0,0.0,77.0, "Poultry"
"Chicken, leg quarter, roasted, meat and skin",20.9,16.9,0.0,236,0.0,0.0,115.0, "Poultry"
"Chicken, leg quarter, roasted, meat and skin, weighed with bone",10.7,8.6,0.0,120,0.0,0.0,60.0, "Poultry"
"Chicken, light meat, raw",24.0,1.1,0.0,106,0.0,0.0,70.0, "Poultry"
"Chicken, light meat, roasted",30.2,3.6,0.0,153,0.0,0.0,82.0, "Poultry"
"Chicken, meat, average, raw",22.3,2.1,0.0,108,0.0,0.0,90.0, "Poultry"
"Chicken, meat, average, roasted",27.3,7.5,0.0,177,0.0,0.0,105.0, "Poultry"
"Chicken, portions, not coated, deep-fried, meat and skin",26.9,16.8,0.0,259,0.0,0.0,135.0, "Poultry"
"Chicken, portions, not coated, deep-fried, meat and skin, weighed with bone",18.6,11.6,0.0,179,0.0,0.0,94.0, "Poultry"
"Chicken, skin, casseroled",13.4,39.3,0.0,407,0.0,0.0,105.0, "Poultry"
"Chicken, skin, raw",9.7,48.3,0.0,474,0.0,0.0,135.0, "Poultry"
"Chicken, skin, roasted/grilled, dry",21.5,46.1,0.0,501,0.0,0.0,170.0, "Poultry"
"Chicken, skin, roasted/grilled, moist",17.0,42.6,0.0,452,0.0,0.0,135.0, "Poultry"
"Chicken, stir-fried with mushrooms and cashew nuts, homemade",18.4,7.0,4.8,160,2.5,2.2,66.1, "Poultry"
"Chicken, stir-fried with peppers in black bean sauce, homemade",19.0,4.2,2.7,124,0.1,2.4,72.5, "Poultry"
"Chicken, stir-fried with rice and vegetables, retail, reheated",6.5,4.6,17.1,132,12.6,3.9,N, "Poultry"
"Chicken, thighs, casseroled, meat and skin",21.5,16.3,0.0,233,0.0,0.0,120.0, "Poultry"
"Chicken, thighs, casseroled, meat and skin, weighed with bone",17.8,13.5,0.0,193,0.0,0.0,100.0, "Poultry"
"Chicken, thighs, casseroled, meat only, diced",25.6,8.6,0.0,180,0.0,0.0,130.0, "Poultry"
"Chicken, whole, corn-fed, raw, meat and skin",18.8,15.9,0.0,218,0.0,0.0,98.0, "Poultry"
"Chicken, whole, corn-fed, raw, meat and skin, weighed with bone",12.2,10.3,0.0,142,0.0,0.0,64.0, "Poultry"
"Chicken, whole, corn-fed, roasted, meat and skin",24.0,13.2,0.0,215,0.0,0.0,110.0, "Poultry"
"Chicken, whole, corn-fed, roasted, meat and skin, weighed with bone",14.4,7.9,0.0,129,0.0,0.0,65.0, "Poultry"
"Chicken, whole, raw, meat and skin",19.1,13.8,0.0,201,0.0,0.0,100.0, "Poultry"
"Chicken, whole, raw, meat and skin, weighed with bone",12.4,9.0,0.0,131,0.0,0.0,66.0, "Poultry"
"Chicken, whole, roasted, meat and skin",26.3,12.5,0.0,218,0.0,0.0,110.0, "Poultry"
"Chicken, whole, roasted, meat and skin, weighed with bone",16.6,7.9,0.0,138,0.0,0.0,71.0, "Poultry"
"Chicken, wing quarter, casseroled, meat and skin",24.4,12.5,0.0,210,0.0,0.0,99.0, "Poultry"
"Chicken, wing quarter, casseroled, meat and skin, weighed with bone",16.3,8.4,0.0,141,0.0,0.0,66.0, "Poultry"
"Chicken, wing quarter, casseroled, meat only",26.9,6.3,0.0,164,0.0,0.0,97.0, "Poultry"
"Chicken, wing quarter, raw, meat and skin",20.3,12.4,0.0,193,0.0,0.0,89.0, "Poultry"
"Chicken, wing quarter, raw, meat and skin, weighed with bone",13.4,8.2,0.0,127,0.0,0.0,59.0, "Poultry"
"Chicken, wing quarter, roasted, meat and skin",24.8,14.1,0.0,226,0.0,0.0,100.0, "Poultry"
"Chicken, wing quarter, roasted, meat and skin, weighed with bone",13.1,7.5,0.0,120,0.0,0.0,53.0, "Poultry"
"Chicken/turkey pasties/slices, puff pastry",8.1,18.5,23.9,289,22.8,1.2,24.3, "Poultry"
"Chicken/turkey pieces, coated, baked",14.4,13.9,19.6,256,18.5,1.1,4.1, "Poultry"
"Chicory, pale variety, boiled in unsalted water",0.6,0.3,2.1,7,0.1,0.5,0.0, "Vegetables"
"Chicory, pale variety, raw",0.5,0.6,2.8,11,0.2,0.7,0.0, "Vegetables"
"Chilli con carne, homemade",9.2,7.5,4.4,120,1.3,2.9,23.8, "Meat"
"Chilli con carne, retail, reheated",7.7,4.3,7.1,96,4.4,2.7,N, "Meat"
"Chilli con carne, retail, reheated, with rice",5.8,2.7,18.1,116,16.5,1.6,N, "Meat"
Chilli powder,13.5,14.3,N,N,N,7.2,0.0, "Spices"
Chilli sauce,1.3,0.8,7.3,40,0.4,6.9,0.0, "Condiments"
"Chilli, bean and lentil, homemade",5.3,2.5,13.2,92,8.0,3.5,0.0, "Legumes"
"Chilli, Quorn, homemade",5.3,3.6,6.9,83,2.7,3.5,0.0, "Vegetables"
"Chilli, vegetable, homemade",2.5,0.8,8.6,49,4.2,3.8,0.0, "Vegetables"
Chinese 5 spice,9.5,8.7,N,N,N,N,0.0, "Spices"
"Chital, raw",18.1,1.9,0.0,90,0.0,0.0,N, "Fish"
"Chives, fresh",3.3,0.7,1.9,27,Tr,1.9,0.0, "Herbs"
"Cho cho fritters, fried in rapeseed oil, homemade",4.7,12.4,16.6,192,13.6,2.9,62.6, "Vegetables"
"Cho cho, boiled in unsalted water",0.5,0.1,2.9,14,0.4,2.5,0.0, "Vegetables"
"Cho cho, raw",0.7,0.1,3.7,17,0.5,3.1,0.0, "Vegetables"
Chocolate covered bar with caramel and cereal,5.2,25.8,66.2,501,11.6,46.4,9.3, "Sweets"
Chocolate covered caramel and biscuit fingers,5.0,23.6,70.0,495,12.2,45.4,9.5, "Sweets"
Chocolate covered wafer biscuit,5.5,28.6,61.1,509,16.1,45.1,16.3, "Sweets"
Chocolate nut spread,6.2,33.0,60.5,549,0.8,59.7,2.0, "Sweets"
Chocolate nut sundae,2.6,15.0,33.5,271,N,29.9,39.1, "Desserts"
Chocolate spread,3.3,37.7,59.4,575,Tr,59.4,8.9, "Sweets"
"Chocolate, dark, with crme or mint fondant centres",3.7,16.3,71.9,431,Tr,62.9,3.3, "Sweets"
"Chocolate, fancy and filled",4.9,21.3,62.9,447,0.2,60.0,11.0, "Sweets"
"Chocolate, milk",7.3,31.1,56.0,519,Tr,56.0,22.1, "Sweets"
"Chocolate, plain",5.0,28.0,63.5,510,0.9,62.6,6.0, "Sweets"
"Chocolate, white",8.0,30.9,58.3,529,Tr,58.3,N, "Sweets"
Chorizo,24.0,32.2,2.4,395,1.3,1.1,N, "Meat"
"Choux buns, homemade",5.3,34.1,17.9,395,17.0,0.9,136.8, "Grains"
"Chow mein, beef, retail, reheated",6.7,6.0,14.7,136,12.3,2.4,N, "Meat"
"Chow mein, chicken, takeaway",8.5,7.2,12.7,147,6.6,0.3,13.4, "Poultry"
"Chow mein, pork and chicken, homemade",9.2,1.9,5.8,72,4.2,1.5,23.5, "Meat"
"Chutney, apple, homemade",0.8,0.2,49.2,190,0.1,48.4,0.0, "Condiments"
"Chutney, mango, sweet",0.7,0.1,48.3,189,2.6,45.7,0.0, "Condiments"
"Chutney, tomato",1.2,0.2,31.0,128,2.9,28.1,0.0, "Condiments"
"Chutney, tomato, homemade",1.0,0.2,40.8,166,Tr,40.2,0.0, "Condiments"
"Cider, dry",Tr,0.0,2.6,36,0.0,2.6,0.0, "Beverages"
"Cider, low alcohol",Tr,0.0,3.6,17,0.0,3.6,0.0, "Beverages"
"Cider, strong",Tr,0.0,7.3,68,0.0,7.3,0.0, "Beverages"
"Cider, sweet",Tr,0.0,4.3,42,0.0,4.3,0.0, "Beverages"
"Cinnamon, ground",4.0,1.2,N,N,N,2.2,0.0, "Spices"
"Citrus fruit, soft/easy peelers, flesh only",0.7,0.2,9.6,41,0.0,9.6,0.0, "Fruits"
"Citrus fruit, soft/easy peelers, flesh only, weighed with peel and pips",0.5,0.2,7.5,32,0.0,7.5,0.0, "Fruits"
"Cloves, dried",6.0,20.1,N,N,Tr,N,0.0, "Spices"
"Cockles, boiled",12.0,0.6,Tr,53,Tr,Tr,53.0, "Seafood"
"Coco fritters, fried in rapeseed oil, homemade",4.7,22.5,26.1,322,25.8,0.9,74.9, "Vegetables"
Cocoa butter,Tr,99.5,0.0,896,0.0,0.0,3.0, "Fats"
Cocoa powder,18.5,21.7,11.5,312,11.5,Tr,0.0, "Baking"
"Cocoa powder, made up with semi-skimmed milk",3.7,2.0,6.7,58,0.2,6.5,5.7, "Beverages"
"Cocoa powder, made up with skimmed milk",3.7,0.6,6.7,46,0.2,6.5,3.5, "Beverages"
"Cocoa powder, made up with whole milk",3.6,3.9,6.6,74,0.2,6.3,11.6, "Beverages"
"Coconut ice, homemade",1.8,12.3,67.1,369,0.0,67.1,1.2, "Sweets"
Coconut milk,0.3,0.3,4.9,22,0.0,4.9,0.0, "Beverages"
"Coconut milk, reduced fat, retail",   0.7,7.7,   2.0,79,0.9,   1.1,0.0, "Beverages"
"Coconut milk, retail",   1.1,16.9,   3.3,169,1.3,   2.0,0.0, "Beverages"
"Coconut, desiccated",5.6,62.0,6.4,604,0.0,6.4,0.0, "Nuts"
"Coconut, flesh only, fresh",3.2,36.0,3.7,351,0.0,3.7,0.0, "Fruits"
"Cod, dried, salted, boiled",32.5,0.9,0.0,138,0.0,0.0,59.0, "Fish"
"Cod, flesh only, baked",23.9,0.5,0.0,100,0.0,0.0,43.3, "Fish"
"Cod, flesh only, baked, weighed with bones and skin",21.3,0.4,0.0,89,0.0,0.0,38.5, "Fish"
"Cod, flesh only, grilled",24.6,0.8,0.0,106,0.0,0.0,73.1, "Fish"
"Cod, flesh only, microwaved",23.5,0.4,0.0,98,0.0,0.0,34.7, "Fish"
"Cod, flesh only, poached in milk, butter and salt added",20.9,1.1,Tr,94,0.0,Tr,53.0, "Fish"
"Cod, flesh only, poached in milk, butter and salt added, weighed with bones and skin",18.2,1.0,Tr,81,0.0,Tr,46.0, "Fish"
"Cod, flesh only, raw",17.5,0.6,0.0,75,0.0,0.0,51.9, "Fish"
"Cod, flesh only, salted and smoked, raw",18.3,0.6,0.0,79,0.0,0.0,46.0, "Fish"
"Cod, flesh only, steamed",22.8,0.8,0.0,98,0.0,0.0,67.7, "Fish"
"Cod, flesh only, steamed, weighed with bones and skin",19.9,0.7,0.0,86,0.0,0.0,58.9, "Fish"
"Cod, in batter, baked",12.3,11.8,19.7,229,17.7,   2.0,36.5, "Fish"
"Cod, in batter, fried in dripping, takeaway",16.8,14.7,10.7,240,9.7,1.0,N, "Fish"
"Cod, in batter, fried in rapeseed oil",12.6,17.9,19.5,285,18.1,   1.4,37.3, "Fish"
"Cod, in batter, fried in sunflower oil, takeaway",16.8,14.7,19.5,240,9.7,1.0,N, "Fish"
"Cod, in batter, fried, takeaway",16.8,14.7,10.7,240,9.7,1.0,60.4, "Fish"
"Cod, in breadcrumbs, baked",13.7,8.3,19.8,204,18.9,0.9,35.6, "Fish"
"Coffee and chicory essence, with water",0.1,Tr,2.4,9,0.1,2.3,0.0, "Beverages"
"Coffee, cappuccino, latte",2.0,0.8,3.2,27,0.8,2.4,2.8, "Beverages"
"Coffee, infusion, average",0.2,Tr,0.3,2,0.0,0.3,0.0, "Beverages"
"Coffee, infusion, average, with semi-skimmed milk",0.6,0.2,0.7,7,0.0,0.7,1.0, "Beverages"
"Coffee, infusion, average, with single cream",0.4,1.2,0.3,14,0.0,0.3,3.0, "Beverages"
"Coffee, infusion, average, with whole milk",0.5,0.4,0.5,7,0.0,0.5,2.0, "Beverages"
"Coffee, infusion, strong",0.2,Tr,0.3,2,0.0,0.0,0.0, "Beverages"
"Coffee, infusion, weak",0.2,Tr,0.3,2,0.0,0.0,0.0, "Beverages"
"Coffee, instant, made up with water",0.0,Tr,Tr,Tr,Tr,0.0,0.0, "Beverages"
"Coffee, instant, made up with water and semi-skimmed milk",0.6,0.2,0.7,7,Tr,0.7,1.0, "Beverages"
"Coffee, instant, made up with water and whole milk",0.5,0.4,0.6,8,Tr,0.5,2.0, "Beverages"
"Coffee, Irish",0.4,8.8,2.7,125,0.0,2.5,22.3, "Beverages"
"Coffee, powder, instant",14.6,Tr,4.5,75,4.5,0.0,0.0, "Beverages"
"Coffeemate, whitener powder",2.1,34.5,57.3,534,Tr,9.4,2.0, "Dairy"
Cola,Tr,0.0,10.9,41,Tr,10.9,0.0, "Beverages"
"Cola, diet",Tr,0.0,Tr,1,0.0,Tr,0.0, "Beverages"
"Cole leaves, dried, boiled in unsalted water",1.7,0.8,1.2,19,0.3,0.9,0.0, "Vegetables"
"Coleslaw, not low calorie, retail",0.8,16.3,6.0,173,Tr,6.0,11.0, "Vegetables"
"Coleslaw, with reduced calorie dressing, retail",0.9,9.1,6.5,110,Tr,6.5,11.9, "Vegetables"
"Coley, flesh only, baked",24.4,1.5,0.0,111,0.0,0.0,64.2, "Fish"
"Coley, flesh only, grilled",27.2,1.4,0.0,105,0.0,0.0,61.0, "Fish"
"Coley, flesh only, poached",25.0,1.5,0.0,114,0.0,0.0,65.7, "Fish"
"Coley, flesh only, raw",18.0,1.1,0.0,82,0.0,0.0,47.0, "Fish"
"Coley, flesh only, steamed",23.0,1.4,0.0,105,0.0,0.0,60.5, "Fish"
"Coley, flesh only, steamed, weighed with bones and skin",20.9,1.3,0.0,95,0.0,0.0,55.0, "Fish"
"Complan powder, original and sweet",15.6,14.7,64.8,438,Tr,42.8,N, "Dairy"
"Complan powder, savoury",16.1,15.6,62.5,439,6.8,6.2,N, "Dairy"
"Complan powder, savoury, made up with water",3.6,3.5,13.9,97,1.5,1.4,N, "Dairy"
"Complan powder, sweet, made up with semi-skimmed milk",6.1,4.5,17.8,132,Tr,13.0,N, "Dairy"
"Complan powder, sweet, made up with skimmed milk",6.1,3.4,17.9,122,Tr,13.1,N, "Dairy"
"Complan powder, sweet, made up with water",3.5,3.3,14.6,98,Tr,9.6,N, "Dairy"
"Complan powder, sweet, made up with whole milk",6.1,6.0,17.7,145,Tr,12.9,N, "Dairy"
"Coo-coo, homemade",2.4,1.8,17.7,99,N,N,2.6, "Grains"
"Cooking fat, compound, not polyunsaturated",Tr,100.0,0.0,900,0.0,0.0,8.0, "Fats"
"Coq au vin, homemade",11.0,11.0,3.3,188,2.9,0.4,67.0, "Poultry"
"Coq au vin, homemade, weighed with bone",9.0,9.0,2.7,150,2.3,0.3,55.3, "Poultry"
"Coriander leaves, dried",21.8,4.8,41.7,279,N,N,0.0, "Herbs"
"Coriander leaves, fresh",2.1,0.5,1.2,18,0.3,0.9,0.0, "Herbs"
Coriander seeds,12.4,17.8,N,N,N,N,0.0, "Spices"
"Corn fritters, fried in rapeseed oil, homemade",5.8,15.2,32.9,287,25.2,4.9,48.6, "Grains"
"Corn pudding, homemade",4.7,2.9,8.9,78,2.8,5.9,55.3, "Vegetables"
Corn snacks,6.0,30.4,60.8,526,55.3,5.5,0.0, "Grains"
"Corned beef hash, homemade",10.5,5.9,12.3,141,10.4,1.9,34.6, "Meat"
"Corned beef, canned",25.9,10.9,1.0,205,0.0,1.0,84.0, "Meat"
Cornetto type ice cream cone,3.5,14.4,39.6,292,11.7,27.9,5.7, "Desserts"
"Cornish pasty, homemade",6.7,19.2,27.8,287,22.4,2.3,13.3, "Meat"
"Cornish pasty, retail",7.0,17.8,24.0,278,21.9,2.1,13.0, "Meat"
"Cornmeal, sifted",9.4,3.3,73.1,368,N,N,, "Grains"
"Coronation chicken, homemade",16.6,31.4,3.5,362,0.1,3.4,82.4, "Poultry"
"Coronation chicken, reduced fat, homemade",16.6,14.8,4.2,216,1.4,2.9,69.8, "Poultry"
"Courgette, boiled in unsalted water",1.3,0.3,1.8,15,0.1,1.7,0.0, "Vegetables"
"Courgette, dried",23.3,3.6,41.2,280,1.8,39.4,0.0, "Vegetables"
"Courgette, fried in butter",2.6,4.8,2.6,63,0.1,2.5,0.0, "Vegetables"
"Courgette, fried in corn oil",2.6,4.8,2.6,63,0.1,2.5,0.0, "Vegetables"
"Courgette, fried in rapeseed oil",2.6,4.8,2.6,63,0.1,2.5,0.0, "Vegetables"
"Courgette, raw",1.3,0.2,2.3,16,0.1,2.2,0.0, "Vegetables"
"Courgette, roasted in rapeseed oil",2.0,1.9,3.6,39,0.2,3.4,0.0, "Vegetables"
"Courgettes with eggs, homemade",3.9,9.7,2.2,112,0.1,2.0,61.9, "Vegetables"
"Couscous, plain, cooked",7.2,1.0,37.5,178,36.5,1.0,0.0, "Grains"
"Couscous, plain, raw",12.0,2.1,79.2,364,76.9,2.3,0.0, "Grains"
"Crab, brown meat, purchased cooked",18.8,7.8,Tr,145,Tr,Tr,271.0, "Seafood"
"Crab, canned in brine, drained",18.1,0.5,Tr,77,Tr,Tr,72.0, "Seafood"
"Crab, purchased cooked",19.7,4.1,Tr,115,Tr,Tr,168.5, "Seafood"
"Crab, white and brown meat, purchased cooked, weighed with shell",8.6,1.8,Tr,51,Tr,Tr,74.1, "Seafood"
"Crab, white meat, purchased cooked",20.5,0.3,Tr,85,Tr,Tr,66.0, "Seafood"
"Crackers, wholemeal, homemade",9.8,10.5,76.7,421,75.9,0.8,1.3, "Grains"
Cranberries,0.4,0.1,3.4,15,0.0,3.4,0.0, "Fruits"
Cranberry fruit juice drink,Tr,0.0,12.1,45,0.0,12.1,0.0, "Beverages"
"Crayfish, raw",14.9,0.8,0.0,67,0.0,0.0,105.0, "Seafood"
Cream crackers,8.9,16.4,69.7,445,68.2,1.5,4.6, "Grains"
Cream of tartar,0.0,0.0,0.0,239,0.0,0.0,0.0, "Baking"
"Cream substitute, double",2.6,35.7,3.6,345,0.0,3.6,11.0, "Dairy"
"Cream substitute, single",3.1,14.5,4.0,158,0.0,4.0,4.0, "Dairy"
"Cream, dairy, extra thick (24% fat)",2.9,23.5,3.4,236,0.0,3.4,73.8, "Dairy"
"Cream, dairy, UHT, canned spray, 85% cream",1.9,24.2,7.2,252,0.0,7.2,68.0, "Dairy"
"Cream, dairy, UHT, half fat, canned spray",2.8,17.3,7.6,196,0.0,7.4,46.0, "Dairy"
"Cream, fresh, clotted",1.6,63.5,2.3,586,0.0,2.3,170.0, "Dairy"
"Cream, fresh, double, including Jersey cream",1.6,53.7,1.7,496,0.0,1.7,137.1, "Dairy"
"Cream, fresh, single",3.3,19.1,2.2,193,0.0,2.2,55.0, "Dairy"
"Cream, fresh, whipping",2.0,40.3,2.7,381,0.0,2.7,105.0, "Dairy"
"Cream, half, fresh",3.0,13.3,4.3,148,0.0,4.3,40.0, "Dairy"
"Crme caramel, homemade",5.1,3.3,28.7,157,0.0,28.7,96.2, "Desserts"
"Creme caramel, retail",3.0,1.6,20.6,104,2.6,18.0,N, "Desserts"
Creme egg,4.0,15.9,71.0,425,Tr,58.0,10.0, "Sweets"
"Creme fraiche, full fat",2.2,40.0,2.4,378,0.3,2.1,112.8, "Dairy"
"Creme fraiche, half fat",2.7,15.0,4.4,162,1.4,3.0,N, "Dairy"
"Crispbread, rye",8.6,1.4,63.4,284,60.0,3.4,0.0, "Grains"
Croissants,8.3,19.7,43.3,373,38.0,5.3,52.0, "Grains"
"Crumble, apple, homemade",1.7,6.4,35.0,201,12.2,23.4,0.9, "Desserts"
"Crumble, fruit, homemade",2.0,6.4,34.5,195,13.3,21.1,0.9, "Desserts"
"Crumble, fruit, retail",2.4,8.3,36.0,219,14.0,21.8,13.2, "Desserts"
"Crumble, fruit, wholemeal, homemade",2.5,7.3,32.7,198,11.4,21.3,17.7, "Desserts"
"Crumble, vegetable, with tinned tomatoes, homemade",3.1,9.6,20.1,174,14.8,4.9,0.8, "Vegetables"
"Crumble, vegetable, with tinned tomatoes, wholemeal, homemade",3.6,9.7,18.1,170,12.6,5.0,0.8, "Vegetables"
"Crumble, vegetable, with white sauce, homemade",4.9,7.9,19.6,165,15.3,4.0,6.4, "Vegetables"
"Crumble, vegetable, with white sauce, wholemeal, homemade",5.4,7.9,20.8,171,15.8,4.6,6.4, "Vegetables"
"Crumble, with pie filling, homemade",1.9,6.6,37.2,207,17.8,19.4,0.9, "Desserts"
"Crumpets, toasted",6.9,1.0,45.4,207,42.3,3.1,0.0, "Grains"
"Cucumber, raw, flesh and skin",1.0,0.6,1.2,14,Tr,1.2,0.0, "Vegetables"
Cumin seeds,17.8,22.3,N,N,N,2.3,0.0, "Spices"
"Curly kale, boiled in unsalted water",2.7,1.3,1.0,26,0.1,0.9,0.0, "Vegetables"
"Curly kale, raw",3.4,1.6,1.4,33,0.1,1.3,0.0, "Vegetables"
"Currant buns, retail",8.0,5.6,52.6,280,36.6,16.0,1.5, "Grains"
"Currant buns, toasted",8.9,6.2,58.4,311,40.7,17.8,1.7, "Grains"
Currants,2.3,0.4,67.8,267,0.0,67.8,0.0, "Fruits"
"Curry leaves, fresh",7.9,1.3,13.3,97,N,N,0.0, "Herbs"
Curry paste,4.7,21.3,11.3,253,4.3,7.0,0.0, "Condiments"
Curry powder,9.5,10.8,26.1,233,N,N,0.0, "Spices"
"Curry powder, mixed flavours",13.0,13.9,34.7,316,N,N,0.0, "Spices"
"Curry, almond, homemade",5.7,33.4,3.3,328,2.0,1.1,55.8, "Nuts"
"Curry, beef and spinach, homemade",11.4,4.4,3.6,94,0.4,2.8,30.7, "Meat"
"Curry, beef, homemade",17.7,15.4,1.2,209,0.2,0.6,49.7, "Meat"
"Curry, beef, reduced fat, homemade",18.8,7.1,1.3,139,0.2,0.7,52.7, "Meat"
"Curry, beef, retail, reheated",13.5,6.6,6.3,137,1.8,4.5,32.0, "Meat"
"Curry, beef, retail, reheated, with rice",9.5,4.6,18.2,147,15.6,2.6,18.2, "Meat"
"Curry, bhindi subji, homemade",2.9,4.6,4.9,71,0.6,4.4,3.9, "Vegetables"
"Curry, black gram, whole and red kidney bean, homemade",4.5,5.0,8.4,94,6.3,1.2,0.0, "Legumes"
"Curry, black gram, whole, Bengali, homemade",4.4,2.8,8.5,76,6.3,1.6,6.5, "Legumes"
"Curry, black gram, whole, Gujerati, homemade",8.4,6.7,15.3,154,11.7,2.5,15.9, "Legumes"
"Curry, black-eye bean, homemade",8.1,4.4,18.4,139,16.1,1.0,0.0, "Legumes"
"Curry, black-eye bean, Punjabi, homemade",6.0,4.0,13.7,111,12.0,1.1,9.0, "Legumes"
"Curry, Bombay potato, homemade",1.8,6.7,13.8,118,12.6,1.2,0.0, "Vegetables"
"Curry, cabbage, masala, homemade",1.7,4.9,8.1,83,1.5,6.4,0.0, "Vegetables"
"Curry, cauliflower and potato, homemade",2.6,2.0,6.7,60,3.8,2.7,0.0, "Vegetables"
"Curry, chick pea dahl and spinach, with butter, homemade",6.4,12.0,12.9,182,11.0,0.9,26.8, "Legumes"
"Curry, chick pea dahl and spinach, with vegetable oil, homemade",6.3,14.2,12.8,201,11.0,0.9,0.0, "Legumes"
"Curry, chick pea dhal, homemade",7.9,6.1,17.8,152,14.6,1.9,0.0, "Legumes"
"Curry, chick pea, UK type, homemade",5.9,3.5,14.3,109,10.8,2.7,0.0, "Legumes"
"Curry, chick pea, whole and potato, homemade",5.9,5.4,12.6,119,10.2,2.1,2.0, "Legumes"
"Curry, chick pea, whole and tomato, Gujerati, with butter ghee, homemade",7.7,14.4,20.1,237,14.8,3.8,31.3, "Legumes"
"Curry, chick pea, whole and tomato, Gujerati, with vegetable oil, homemade",7.7,14.7,20.1,238,14.8,3.8,0.0, "Legumes"
"Curry, chick pea, whole and tomato, Punjabi, with butter, homemade",5.6,4.3,12.4,107,10.8,1.1,8.0, "Legumes"
"Curry, chick pea, whole and tomato, Punjabi, with vegetable oil, homemade",5.6,4.9,12.4,112,10.8,1.1,0.0, "Legumes"
"Curry, chick pea, whole, Gujerati type, homemade",9.7,7.6,21.8,183,19.2,1.2,0.0, "Legumes"
"Curry, chicken balti, retail",10.5,5.0,4.8,105,1.3,3.5,28.6, "Poultry"
"Curry, chicken korma, homemade",14.6,5.1,4.6,127,1.4,2.8,53.1, "Poultry"
"Curry, chicken tandoori, retail, reheated",27.4,10.8,2.0,214,1.0,1.0,120.0, "Poultry"
"Curry, chicken tikka masala, retail, reheated",12.4,9.8,4.9,156,1.3,3.6,46.2, "Poultry"
"Curry, chicken vindaloo, homemade",18.5,12.5,2.6,192,0.3,1.7,70.5, "Poultry"
"Curry, chicken vindaloo, reduced fat, homemade",19.6,4.1,2.7,121,0.4,1.8,74.6, "Poultry"
"Curry, chicken, average, retail, reheated",12.1,8.9,5.4,149,1.0,4.4,51.0, "Poultry"
"Curry, chicken, average, retail, reheated with rice",8.5,5.8,18.2,154,15.8,2.4,28.0, "Poultry"
"Curry, chicken, average, takeaway",11.7,9.8,2.5,145,1.2,1.2,37.0, "Poultry"
"Curry, chicken, made with cook-in sauce",18.6,5.4,5.5,144,1.6,3.9,N, "Poultry"
"Curry, chicken, Thai green, takeaway and restaurant",8.8,8.7,1.5,119,1.0,0.5,25.9, "Poultry"
"Curry, courgette and potato, homemade",1.8,5.9,9.6,96,7.7,1.8,0.0, "Vegetables"
"Curry, dudhi, kofta, homemade",2.6,6.9,9.3,111,N,N,6.6, "Vegetables"
"Curry, egg and potato, homemade",7.5,9.3,6.5,138,4.6,1.5,165.1, "Eggs"
"Curry, egg, in sweet sauce, UK type, homemade",6.3,7.3,5.9,112,1.9,3.4,144.0, "Eggs"
"Curry, egg, with butter, homemade",5.4,10.6,4.7,135,0.3,3.4,131.9, "Eggs"
"Curry, egg, with rapeseed oil, homemade",5.3,12.2,4.7,149,0.3,3.3,112.7, "Eggs"
"Curry, fish and vegetable, Bangladeshi, homemade",9.1,8.7,1.4,118,0.1,1.1,N, "Fish"
"Curry, fish, Bangladeshi, homemade",12.4,8.0,1.5,125,Tr,1.2,N, "Fish"
"Curry, fish, homemade",11.3,9.6,1.9,139,Tr,1.9,13.8, "Fish"
"Curry, green bean, masala, homemade",1.7,12.5,4.4,130,1.8,2.6,0.0, "Vegetables"
"Curry, haddock, Bengali, homemade",11.4,22.0,4.2,263,0.1,3.2,85.2, "Fish"
"Curry, herring, Bengali, homemade",11.4,29.6,4.2,327,0.1,3.2,85.8, "Fish"
"Curry, karela, homemade",1.6,9.7,4.6,111,0.5,3.3,0.0, "Vegetables"
"Curry, lamb biryani, homemade",7.1,9.2,20.9,195,18.3,2.0,16.5, "Meat"
"Curry, lamb biryani, reduced fat, homemade",7.4,3.7,21.9,150,19.2,2.0,16.6, "Meat"
"Curry, lamb rogan josh, homemade",14.4,9.1,3.9,149,0.3,3.0,45.6, "Meat"
"Curry, lamb vindaloo, homemade",19.8,12.9,2.7,199,0.4,1.8,64.6, "Meat"
"Curry, lamb, made with cook-in sauce",15.5,17.7,5.5,242,1.6,3.9,63.0, "Meat"
"Curry, lentil, red/masoor dahl and mung bean dahl, homemade",4.8,6.7,10.1,116,8.3,0.9,0.0, "Legumes"
"Curry, lentil, red/masoor dahl and tomato, Punjabi, homemade",3.2,5.5,8.5,93,5.7,2.4,0.0, "Legumes"
"Curry, lentil, red/masoor dahl and tomato, with butter, homemade",4.3,5.3,10.6,104,8.7,1.1,12.8, "Legumes"
"Curry, lentil, red/masoor dahl and tomato, with vegetable oil, homemade",4.3,6.3,10.6,113,8.7,1.1,0.0, "Legumes"
"Curry, lentil, red/masoor dahl and vegetable, UK type, homemade",5.7,3.8,14.8,112,11.4,2.4,0.0, "Legumes"
"Curry, lentil, red/masoor dahl, mung bean dahl and tomato, homemade",4.4,4.3,9.7,92,8.5,0.8,0.0, "Legumes"
"Curry, lentil, red/masoor dahl, Punjabi, homemade",7.2,4.6,19.3,141,13.7,3.9,0.0, "Legumes"
"Curry, lentil, red/masoor dahl, with butter, homemade",7.6,6.6,19.3,161,15.6,2.2,15.8, "Legumes"
"Curry, lentil, red/masoor dahl, with vegetable oil, homemade",7.6,7.9,19.2,173,15.6,2.2,0.0, "Legumes"
"Curry, lentil, whole/masoor, Gujerati, homemade",6.5,5.3,17.0,137,12.7,3.1,12.8, "Legumes"
"Curry, lentil, whole/masoor, Punjabi, homemade",5.7,8.3,13.9,148,11.3,1.4,0.0, "Legumes"
"Curry, mung bean dahl and spinach, homemade",7.8,2.9,12.3,102,8.5,3.0,0.0, "Legumes"
"Curry, mung bean dahl and tomato, homemade",5.6,3.6,11.2,95,9.8,0.8,0.0, "Legumes"
"Curry, mung bean dahl, Bengali, homemade",4.2,3.4,7.4,74,6.2,0.5,8.1, "Legumes"
"Curry, mung bean, whole and turnip leaves, homemade",4.4,14.4,6.2,169,5.0,0.3,15.3, "Legumes"
"Curry, mung bean, whole, Gujerati, homemade",6.0,5.9,13.2,126,9.5,2.5,0.0, "Legumes"
"Curry, mung bean, whole, Punjabi, homemade",4.2,2.8,8.8,74,6.9,1.0,6.5, "Legumes"
"Curry, pea and potato, homemade",2.5,11.0,10.2,147,6.2,2.7,0.0, "Vegetables"
"Curry, pigeon pea dahl and tomato, homemade",2.3,2.2,7.3,56,5.6,1.5,0.0, "Legumes"
"Curry, pigeon pea dahl with tomatoes and peanuts, homemade",6.9,3.3,16.9,121,15.2,1.0,0.0, "Legumes"
"Curry, pigeon pea dahl, with butter, homemade",4.6,4.7,13.5,108,10.9,2.1,10.5, "Legumes"
"Curry, pigeon pea dahl, with vegetable oil, homemade",4.6,5.5,13.5,116,10.9,2.1,0.0, "Legumes"
"Curry, potato and pea, homemade",2.7,3.7,13.0,92,7.6,3.7,0.0, "Vegetables"
"Curry, potato, Gujerati, homemade",1.5,5.4,11.8,94,9.7,2.1,0.0, "Vegetables"
"Curry, potato, Punjabi, homemade",1.8,4.0,13.8,94,11.0,2.4,9.8, "Vegetables"
"Curry, prawn and mushroom, homemade",5.7,14.3,2.7,164,0.6,1.7,38.0, "Seafood"
"Curry, Prawn bhuna, takeaway",8.6,8.7,1.8,120,0.6,1.2,158.0, "Seafood"
"Curry, Prawn madras, takeaway",7.8,8.3,2.5,115,1.3,1.2,130.2, "Seafood"
"Curry, prawn, takeaway",8.2,8.5,2.3,118,0.9,1.4,144.1, "Seafood"
