Food Name,Protein (g),Fat (g),Carbohydrate (g),Energy (kcal) (kcal),Starch (g),Total sugars (g),Cholesterol (mg)
"Ice cream, non dairy, vanilla, soft scoop",2.6,7.7,29.8,192,0.0,23.5,13.3, "Sweets"
"Ice cream, virtually fat free alternative",4.4,0.8,20.6,102,Tr,19.0,N, "Sweets"
"Iced buns, retail",6.0,7.8,60.8,322,35.0,25.8,4.7, "Bakery"
"Icing, butter, homemade",0.2,29.4,63.4,507,0.7,62.8,76.2, "Bakery"
"Icing, fondant, homemade",1.3,Tr,90.1,343,Tr,88.9,0.0, "Bakery"
"Icing, glace, homemade",Tr,0.0,88.9,333,0.9,88.0,0.0, "Bakery"
"Icing, Royal, homemade",1.1,Tr,93.4,354,1.0,92.4,0.0, "Bakery"
"Instant dessert powder, made up with skimmed milk",3.3,3.2,14.4,96,3.4,11.0,3.2, "Sweets"
"Instant dessert powder, made up with whole milk",3.2,6.0,14.3,121,3.4,10.9,10.1, "Sweets"
"Instant drinks powder, chocolate, low calorie",16.0,11.1,52.0,359,Tr,33.6,3.0, "Beverages"
"Instant drinks powder, malted, unfortified",5.7,6.2,82.5,388,Tr,54.8,3.5, "Beverages"
"Jackfish, raw",21.7,2.4,0.0,108,0.0,0.0,54.0, "Seafood"
"Jackfruit, raw",1.3,0.3,21.4,88,0.8,20.6,0.0, "Fruits"
Jaffa cakes,4.4,8.5,69.3,354,16.3,51.6,9.4, "Sweets"
"Jam tarts, retail",3.2,13.5,58.2,353,26.2,32.1,2.8, "Sweets"
"Jam, fruit with edible seeds",0.6,0.0,69.0,261,0.0,69.0,0.0, "Miscellaneous"
"Jam, reduced sugar",0.5,0.1,31.9,123,0.0,31.9,0.0, "Miscellaneous"
"Jam, stone fruit",0.4,0.0,69.3,261,0.0,69.3,0.0, "Miscellaneous"
"Jambu fruit, flesh only",0.7,0.3,12.4,55,Tr,N,0.0, "Fruits"
"Jellabi, homemade",4.2,14.9,57.5,369,39.2,N,0.0, "Sweets"
"Jelly, made with skimmed milk",2.6,Tr,16.8,73,0.0,16.8,Tr, "Sweets"
"Jelly, made with water",1.2,Tr,15.1,61,0.0,15.1,0.0, "Sweets"
"Jelly, sugar free, made with water",1.6,0.0,Tr,6,0.0,0.0,0.0, "Sweets"
"John Dory, raw",19.0,1.4,0.0,89,0.0,0.0,N, "Seafood"
"Jujube, flesh only",1.5,0.3,19.7,87,Tr,19.7,0.0, "Fruits"
"Kalabasu, raw",14.7,1.0,0.0,68,0.0,0.0,N, "Vegetables"
"Katla, raw",19.5,2.4,0.0,100,0.0,0.0,N, "Seafood"
"Kebabs, pork and pineapple, homemade",14.4,9.9,5.9,170,0.1,6.1,41.1, "Meat"
"Kedgeree, homemade",15.9,7.7,9.1,167,9.1,Tr,128.8, "Seafood"
Khadhi,3.4,2.8,6.6,63,2.0,4.5,7.9, "Grains and Staples"
Khatiyu,8.5,7.0,25.8,192,19.9,3.8,0.0, "Grains and Staples"
"Kheema, beef, homemade",11.7,10.8,4.6,160,1.5,2.6,30.2, "Meat"
"Kheema, lamb, homemade",11.0,13.4,4.0,178,1.1,2.4,37.6, "Meat"
"Kheema, lamb, reduced fat, homemade",11.4,9.4,3.2,142,1.1,1.6,38.8, "Meat"
"Khichadi, with butter ghee",4.8,5.2,27.3,169,26.6,0.2,11.7, "Grains and Staples"
"Khichadi, with vegetable oil",4.8,5.2,27.0,169,26.6,0.2,0.0, "Grains and Staples"
"Kidney, lamb, fried in corn oil",23.7,10.3,0.0,188,0.0,0.0,610.0, "Meat"
"Kidney, lamb, raw",17.0,2.6,0.0,91,0.0,0.0,315.0, "Meat"
"Kidney, ox, raw",17.2,2.1,0.0,88,0.0,0.0,265.0, "Meat"
"Kidney, ox, stewed",24.5,4.4,0.0,138,0.0,0.0,460.0, "Meat"
"Kidney, pig, fried",29.2,9.5,0.0,202,0.0,0.0,N, "Meat"
"Kidney, pig, raw",15.5,2.7,0.0,86,0.0,0.0,410.0, "Meat"
"Kidney, pig, stewed",24.4,6.1,0.0,153,0.0,0.0,700.0, "Meat"
"Kippers, flesh only, boil in the bag, with butter, cooked",18.6,13.2,Tr,193,0.0,Tr,71.0, "Seafood"
"Kippers, flesh only, grilled",21.7,17.6,0.0,245,0.0,0.0,65.0, "Seafood"
"Kippers, flesh only, grilled, fillets weighed with bones and skin",19.3,15.7,0.0,219,0.0,0.0,58.2, "Seafood"
"Kiwi fruit, flesh only, raw",0.8,0.9,8.6,44,0.3,8.3,0.0, "Fruits"
"Kiwi fruit, flesh only, raw, weighed with skin",0.6,0.7,6.2,32,0.2,6.0,0.0, "Fruits"
"Knickerbocker glory, homemade",2.4,6.3,16.4,128,0.1,14.1,8.6, "Sweets"
"Kofta, beef, homemade",25.3,20.5,1.3,290,Tr,0.8,112.4, "Meat"
"Kofta, lamb, coated with breadcrumbs, homemade",23.8,16.0,9.7,277,8.2,0.9,122.7, "Meat"
"Kohl rabi, boiled in unsalted water",1.2,0.2,3.1,18,0.1,3.0,0.0, "Vegetables"
"Kohl rabi, raw",1.6,0.2,3.7,23,0.1,3.6,0.0, "Vegetables"
"Kulfi, homemade",5.7,42.4,13.8,457,0.2,13.6,100.5, "Sweets"
"Kumquats, whole fruit, raw",0.9,0.5,9.3,43,0.0,9.3,0.0, "Fruits"
"Lager, alcohol-free",0.4,Tr,1.5,7,0.0,1.2,0.0, "Beverages"
"Lager, extra strong",0.3,Tr,2.4,60,0.0,2.4,0.0, "Beverages"
"Lager, low alcohol",0.3,Tr,0.5,16,0.0,0.5,0.0, "Beverages"
"Lager, premium",0.3,Tr,Tr,29,0.0,Tr,0.0, "Beverages"
"Lager, standard",0.3,Tr,Tr,24,0.0,Tr,0.0, "Beverages"
"Lamb stir-fried with vegetables, homemade",16.4,18.4,2.3,244,0.3,2.0,66.2, "Meat"
"Lamb, average, raw, lean and fat",19.0,12.3,0.0,187,0.0,0.0,78.0, "Meat"
"Lamb, best end neck cutlets, barbecued, lean",27.7,13.9,0.0,236,0.0,0.0,98.0, "Meat"
"Lamb, best end neck cutlets, barbecued, lean and fat",24.3,27.2,0.0,342,0.0,0.0,98.0, "Meat"
"Lamb, best end neck cutlets, barbecued, lean and fat, weighed with bone",17.5,19.6,0.0,246,0.0,0.0,71.0, "Meat"
"Lamb, best end neck cutlets, barbecued, lean, weighed with fat and bone",14.1,7.1,0.0,120,0.0,0.0,50.0, "Meat"
"Lamb, best end neck cutlets, grilled, lean",28.5,13.8,0.0,238,0.0,0.0,100.0, "Meat"
"Lamb, best end neck cutlets, grilled, lean and fat",24.5,29.9,0.0,367,0.0,0.0,105.0, "Meat"
"Lamb, best end neck cutlets, grilled, lean and fat, weighed with bone",17.6,21.0,0.0,259,0.0,0.0,76.0, "Meat"
"Lamb, best end neck cutlets, grilled, lean, weighed with fat and bone",13.7,6.6,0.0,114,0.0,0.0,48.0, "Meat"
"Lamb, best end neck cutlets, raw, lean and fat",16.3,27.9,0.0,316,0.0,0.0,76.0, "Meat"
"Lamb, best end neck cutlets, raw, lean and fat, weighed with bone",11.9,20.4,0.0,231,0.0,0.0,56.0, "Meat"
"Lamb, breast, raw, lean",19.6,11.2,0.0,179,0.0,0.0,76.0, "Meat"
"Lamb, breast, raw, lean and fat",16.2,24.7,0.0,287,0.0,0.0,80.0, "Meat"
"Lamb, breast, roasted, lean",26.7,18.5,0.0,273,0.0,0.0,95.0, "Meat"
"Lamb, breast, roasted, lean and fat",22.4,29.9,0.0,359,0.0,0.0,93.0, "Meat"
"Lamb, chump chops, fried, lean",28.1,11.2,0.0,213,0.0,0.0,100.0, "Meat"
"Lamb, chump chops, fried, lean and fat",24.7,23.2,0.0,308,0.0,0.0,98.0, "Meat"
"Lamb, chump chops, fried, lean and fat, weighed with bone",20.5,19.3,0.0,256,0.0,0.0,81.0, "Meat"
"Lamb, chump chops, fried, lean, weighed with fat and bone",17.7,7.1,0.0,135,0.0,0.0,63.0, "Meat"
"Lamb, chump chops, raw, lean and fat",18.3,18.8,0.0,242,0.0,0.0,74.0, "Meat"
"Lamb, chump chops, raw, lean and fat, weighed with bone",15.9,16.4,0.0,211,0.0,0.0,64.0, "Meat"
"Lamb, chump steaks, fried, lean and fat",24.8,20.4,0.0,283,0.0,0.0,96.0, "Meat"
"Lamb, chump steaks, raw, lean and fat",18.6,16.4,0.0,222,0.0,0.0,73.0, "Meat"
"Lamb, fat, average, cooked",15.4,56.3,0.0,568,0.0,0.0,100.0, "Fats and Oils"
"Lamb, fat, average, raw",13.3,51.6,0.0,518,0.0,0.0,92.0, "Fats and Oils"
"Lamb, fat, raw, average, extra trimmed",6.5,77.2,0.0,721,0.0,0.0,N, "Fats and Oils"
"Lamb, lean only, raw, average",20.2,8.0,0.0,153,0.0,0.0,74.0, "Meat"
"Lamb, lean only, raw, average, extra trimmed",20.0,7.5,0.0,148,0.0,0.0,N, "Meat"
"Lamb, leg chops, grilled, lean and fat",28.3,12.0,0.0,221,0.0,0.0,105.0, "Meat"
"Lamb, leg chops, grilled, lean and fat, weighed with bone",23.8,10.1,0.0,186,0.0,0.0,88.0, "Meat"
"Lamb, leg joint, roasted, lean",30.8,9.6,0.0,210,0.0,0.0,110.0, "Meat"
"Lamb, leg joint, roasted, lean and fat",29.7,13.0,0.0,236,0.0,0.0,110.0, "Meat"
"Lamb, leg steaks, grilled, lean",29.2,9.0,0.0,198,0.0,0.0,105.0, "Meat"
"Lamb, leg steaks, grilled, lean and fat",28.0,13.2,0.0,231,0.0,0.0,105.0, "Meat"
"Lamb, leg, half fillet, braised, lean",27.3,10.5,0.0,204,0.0,0.0,97.0, "Meat"
"Lamb, leg, half fillet, braised, lean and fat",25.6,17.1,0.0,256,0.0,0.0,99.0, "Meat"
"Lamb, leg, half knuckle, pot-roasted, lean",29.4,9.3,0.0,201,0.0,0.0,105.0, "Meat"
"Lamb, leg, half knuckle, pot-roasted, lean and fat",28.1,13.8,0.0,237,0.0,0.0,105.0, "Meat"
"Lamb, leg, half knuckle, pot-roasted, lean and fat, weighed with bone",20.5,10.1,0.0,173,0.0,0.0,77.0, "Meat"
"Lamb, leg, whole, roasted well done, lean",31.3,9.2,0.0,208,0.0,0.0,110.0, "Meat"
"Lamb, leg, whole, roasted well done, lean and fat",29.8,13.6,0.0,242,0.0,0.0,110.0, "Meat"
"Lamb, leg, whole, roasted, lean and fat",28.1,14.2,0.0,240,0.0,0.0,100.0, "Meat"
"Lamb, leg, whole, roasted, lean only",29.7,9.4,0.0,203,0.0,0.0,100.0, "Meat"
"Lamb, loin chops, grilled, lean",29.2,10.7,0.0,213,0.0,0.0,96.0, "Meat"
"Lamb, loin chops, grilled, lean and fat",26.5,22.1,0.0,305,0.0,0.0,100.0, "Meat"
"Lamb, loin chops, grilled, lean and fat, weighed with bone",21.5,17.9,0.0,247,0.0,0.0,81.0, "Meat"
"Lamb, loin chops, grilled, lean, weighed with fat and bone",17.8,6.5,0.0,130,0.0,0.0,59.0, "Meat"
"Lamb, loin chops, microwaved, lean",32.4,12.5,0.0,242,0.0,0.0,115.0, "Meat"
"Lamb, loin chops, microwaved, lean and fat",27.5,26.9,0.0,352,0.0,0.0,110.0, "Meat"
"Lamb, loin chops, microwaved, lean and fat, weighed with bone",22.5,22.1,0.0,289,0.0,0.0,90.0, "Meat"
"Lamb, loin chops, microwaved, lean, weighed with fat and bone",18.8,7.3,0.0,141,0.0,0.0,67.0, "Meat"
"Lamb, loin chops, raw, lean and fat",17.6,23.0,0.0,277,0.0,0.0,79.0, "Meat"
"Lamb, loin chops, raw, lean and fat, weighed with bone",13.7,17.9,0.0,216,0.0,0.0,62.0, "Meat"
"Lamb, loin chops, roasted, lean",34.4,13.3,0.0,257,0.0,0.0,120.0, "Meat"
"Lamb, loin chops, roasted, lean and fat",29.1,26.9,0.0,359,0.0,0.0,115.0, "Meat"
"Lamb, loin chops, roasted, lean and fat, weighed with bone",22.4,20.7,0.0,316,0.0,0.0,100.0, "Meat"
"Lamb, loin chops, roasted, lean, weighed with fat and bone",19.3,7.4,0.0,144,0.0,0.0,68.0, "Meat"
"Lamb, loin joint, raw, lean and fat",16.9,26.6,0.0,307,0.0,0.0,80.0, "Meat"
"Lamb, loin joint, raw, lean and fat, weighed with bone",13.0,20.5,0.0,236,0.0,0.0,62.0, "Meat"
"Lamb, loin joint, roasted, lean",28.2,10.7,0.0,209,0.0,0.0,100.0, "Meat"
"Lamb, loin joint, roasted, lean and fat",25.3,22.4,0.0,303,0.0,0.0,100.0, "Meat"
"Lamb, loin joint, roasted, lean and fat, weighed with bone",18.7,16.6,0.0,224,0.0,0.0,74.0, "Meat"
"Lamb, mince, raw",19.1,13.3,0.0,196,0.0,0.0,77.0, "Meat"
"Lamb, mince, stewed",24.4,12.3,0.0,208,0.0,0.0,96.0, "Meat"
"Lamb, mince, stewed with onions",10.6,8.5,2.8,129,1.8,0.6,40.4, "Meat"
"Lamb, neck fillet, raw, lean",19.4,13.9,0.0,203,0.0,0.0,75.0, "Meat"
"Lamb, neck fillet, raw, lean and fat",18.4,17.6,0.0,232,0.0,0.0,79.0, "Meat"
"Lamb, neck fillet, slices, grilled, lean",27.9,19.1,0.0,284,0.0,0.0,99.0, "Meat"
"Lamb, neck fillet, slices, grilled, lean and fat",26.3,21.9,0.0,302,0.0,0.0,97.0, "Meat"
"Lamb, neck fillet, strips, stir-fried in corn oil, lean",24.4,20.0,0.0,278,0.0,0.0,86.0, "Meat"
"Lamb, neck fillet, strips, stir-fried in corn oil, lean and fat",23.2,23.1,0.0,301,0.0,0.0,91.0, "Meat"
"Lamb, New Zealand, leg, whole, chilled, roasted, lean",28.8,10.2,0.0,207,0.0,0.0,110.0, "Meat"
"Lamb, New Zealand, leg, whole, chilled, roasted, lean and fat",28.0,13.1,0.0,230,0.0,0.0,110.0, "Meat"
"Lamb, New Zealand, leg, whole, frozen, raw, lean and fat, weighed with bone",15.0,11.1,0.0,160,0.0,0.0,58.0, "Meat"
"Lamb, New Zealand, leg, whole, frozen, roasted, lean",30.6,9.3,0.0,206,0.0,0.0,110.0, "Meat"
"Lamb, New Zealand, leg, whole, frozen, roasted, lean and fat",29.0,14.1,0.0,243,0.0,0.0,110.0, "Meat"
"Lamb, New Zealand, leg, whole, frozen, roasted, lean and fat, weighed with bone",21.2,10.3,0.0,178,0.0,0.0,82.0, "Meat"
"Lamb, New Zealand, loin chops, frozen, grilled, lean",31.4,13.7,0.0,249,0.0,0.0,110.0, "Meat"
"Lamb, New Zealand, loin chops, frozen, grilled, lean and fat",26.9,28.5,0.0,364,0.0,0.0,105.0, "Meat"
"Lamb, New Zealand, loin chops, frozen, grilled, lean and fat, weighed with bone",21.2,22.5,0.0,287,0.0,0.0,83.0, "Meat"
"Lamb, New Zealand, loin chops, frozen, grilled, lean, weighed with fat and bone",18.5,8.1,0.0,147,0.0,0.0,65.0, "Meat"
"Lamb, New Zealand, mince, frozen, stewed",20.9,17.7,0.0,243,0.0,0.0,110.0, "Meat"
"Lamb, New Zealand, shoulder, whole, frozen, roasted, lean",27.6,15.6,0.0,251,0.0,0.0,97.0, "Meat"
"Lamb, New Zealand, shoulder, whole, frozen, roasted, lean and fat",24.6,27.9,0.0,350,0.0,0.0,98.0, "Meat"
"Lamb, rack of, lean, roasted",27.1,13.0,0.0,225,0.0,0.0,96.0, "Meat"
"Lamb, rack of, raw, lean and fat",17.3,23.8,0.0,283,0.0,0.0,75.0, "Meat"
"Lamb, rack of, raw, lean and fat, weighed with bone",12.5,17.1,0.0,204,0.0,0.0,54.0, "Meat"
"Lamb, rack of, roasted, lean and fat",23.0,30.1,0.0,363,0.0,0.0,97.0, "Meat"
"Lamb, shoulder joint, roasted, lean",28.4,13.5,0.0,235,0.0,0.0,100.0, "Meat"
"Lamb, shoulder joint, roasted, lean and fat",25.9,19.8,0.0,282,0.0,0.0,100.0, "Meat"
"Lamb, shoulder, diced, kebabs, grilled, lean and fat",28.5,19.3,0.0,288,0.0,0.0,110.0, "Meat"
"Lamb, shoulder, half bladeside, pot-roasted, lean",26.2,14.3,0.0,234,0.0,0.0,93.0, "Meat"
"Lamb, shoulder, half bladeside, pot-roasted, lean and fat",23.5,25.6,0.0,324,0.0,0.0,98.0, "Meat"
"Lamb, shoulder, half knuckle, braised, lean",25.1,12.4,0.0,212,0.0,0.0,89.0, "Meat"
"Lamb, shoulder, half knuckle, braised, lean and fat",22.9,23.4,0.0,302,0.0,0.0,94.0, "Meat"
"Lamb, shoulder, raw, lean and fat",17.6,18.3,0.0,235,0.0,0.0,76.0, "Meat"
"Lamb, shoulder, raw, lean and fat, weighed with bone",14.1,14.6,0.0,188,0.0,0.0,61.0, "Meat"
"Lamb, shoulder, whole, roasted, lean",27.2,12.1,0.0,218,0.0,0.0,105.0, "Meat"
"Lamb, shoulder, whole, roasted, lean and fat",24.7,22.1,0.0,298,0.0,0.0,105.0, "Meat"
"Lamb, shoulder, whole, roasted, lean and fat, weighed with bone",19.5,17.5,0.0,235,0.0,0.0,83.0, "Meat"
"Lamb, stewing, pressure cooked, lean",28.7,14.8,0.0,248,0.0,0.0,100.0, "Meat"
"Lamb, stewing, pressure cooked, lean and fat",25.7,20.9,0.0,291,0.0,0.0,98.0, "Meat"
"Lamb, stewing, raw, lean and fat",22.5,12.6,0.0,203,0.0,0.0,78.0, "Meat"
"Lamb, stewing, raw, lean and fat, weighed with bone",15.1,8.4,0.0,136,0.0,0.0,52.0, "Meat"
"Lamb, stewing, stewed, lean",26.6,14.8,0.0,240,0.0,0.0,94.0, "Meat"
"Lamb, stewing, stewed, lean and fat",24.4,20.1,0.0,279,0.0,0.0,92.0, "Meat"
"Lamb's heart casserole, homemade",11.8,8.1,9.9,161,9.1,0.6,91.6, "Meat"
"Lancashire hotpot, homemade",7.3,6.9,7.4,119,5.8,1.4,27.4, "Meat"
"Langoustine, boiled",19.7,0.8,0.0,86,0.0,0.0,133.0, "Seafood"
Lard,Tr,99.0,0.0,891,0.0,0.0,93.0, "Fats and Oils"
"Lasagne, homemade",9.6,9.6,15.2,180,12.3,2.8,24.8, "Vegetarian"
"Lasagne, homemade, with extra lean minced beef",10.1,7.0,15.2,160,12.3,2.8,19.9, "Meat"
"Lasagne, retail, reheated",7.4,6.1,15.7,143,12.7,3.0,18.0, "Vegetarian"
"Lasagne, spinach, wholemeal, homemade",4.2,3.1,13.0,93,10.9,2.2,6.0, "Vegetarian"
"Lasagne, vegetable, retail",4.8,5.3,13.4,117,9.0,4.4,N, "Vegetarian"
"Lasagne, vegetable, wholemeal, homemade",4.8,4.6,12.4,106,9.4,3.0,9.0, "Vegetarian"
"Lassi, sweetened",2.6,0.9,12.3,65,0.2,11.9,N, "Beverages"
Laverbread,3.2,3.7,1.6,52,1.6,Tr,0.0, "Vegetables"
"Leeks in cheese sauce, made with semi-skimmed milk, homemade",4.0,5.5,4.6,82,1.8,2.6,14.0, "Vegetables"
"Leeks in cheese sauce, made with skimmed milk, homemade",4.0,5.0,4.6,79,1.8,2.6,13.4, "Vegetables"
"Leeks in cheese sauce, made with whole milk, homemade",4.0,6.0,4.5,87,1.8,2.5,15.9, "Vegetables"
"Leeks, boiled in unsalted water",1.2,0.2,2.5,16,0.2,2.3,0.0, "Vegetables"
"Leeks, raw",1.5,0.2,4.1,23,0.3,3.8,0.0, "Vegetables"
"Leeks, roasted in rapeseed oil",1.7,1.9,4.5,41,0.3,4.2,0.0, "Vegetables"
"Lemon chicken, homemade",16.9,6.2,7.1,150,3.8,3.3,47.7, "Meat"
Lemon curd,0.6,4.9,58.4,266,5.9,52.5,21.0, "Sweets"
"Lemon curd, homemade",4.2,16.0,50.7,350,0.0,50.7,145.5, "Sweets"
"Lemon juice, fresh",0.3,Tr,1.6,7,0.0,1.6,0.0, "Beverages"
"Lemon juice, fresh, weighed as whole fruit",0.1,Tr,0.6,2,0.0,0.6,0.0, "Beverages"
Lemon peel,1.5,0.3,N,N,0.0,N,0.0, "Vegetables"
"Lemon sole, flesh only, grilled",21.5,0.6,0.0,91,0.0,0.0,40.3, "Seafood"
"Lemon sole, flesh only, raw",16.7,0.7,0.0,73,0.0,0.0,47.0, "Seafood"
"Lemon sole, flesh only, steamed",21.7,0.9,0.0,95,0.0,0.0,61.5, "Seafood"
"Lemon sole, flesh only, steamed, weighed with bones and skin",16.7,0.7,0.0,73,0.0,0.0,47.0, "Seafood"
"Lemon sole, goujons, baked",16.0,14.6,14.7,187,13.9,0.9,55.0, "Seafood"
Lemonade,Tr,0.0,5.8,22,0.0,5.8,0.0, "Beverages"
"Lemonade, homemade",Tr,Tr,16.7,63,0.0,16.7,0.0, "Beverages"
"Lemons, flesh only, raw, weighed with peel and pips",0.5,0.2,1.4,9,0.0,1.4,0.0, "Fruits"
"Lemons, peeled, flesh only",0.8,0.3,2.2,14,0.0,2.2,0.0, "Fruits"
"Lemons, whole, without pips",1.0,0.3,3.2,19,0.0,3.2,0.0, "Fruits"
"Lentil and nut roast, homemade",10.6,12.1,18.8,222,15.4,2.7,0.0, "Vegetarian"
"Lentil and nut roast, with egg, homemade",10.8,12.1,17.6,218,14.5,2.6,26.0, "Vegetarian"
"Lentil and potato pie, homemade",5.3,2.2,18.6,111,16.6,1.4,0.0, "Vegetarian"
"Lentil and rice roast, homemade",5.1,1.8,25.2,131,23.6,1.1,0.1, "Vegetarian"
"Lentil and rice roast, with egg, homemade",5.5,2.1,24.1,131,22.7,1.1,15.4, "Vegetarian"
"Lentil cutlets, fried in vegetable oil, homemade",8.5,8.3,24.2,199,20.8,1.2,0.0, "Vegetarian"
"Lentil pie, homemade",6.9,4.3,29.1,175,24.1,4.2,0.0, "Vegetarian"
"Lentil roast, homemade",7.7,3.0,21.9,139,18.6,2.5,0.0, "Vegetarian"
"Lentil roast, with egg, homemade",8.2,3.6,20.3,141,17.2,2.3,32.0, "Vegetarian"
"Lentils, green and brown, whole, dried, boiled in unsalted water",7.8,0.7,14.5,92,14.3,0.2,0.0, "Legumes"
"Lentils, green and brown, whole, dried, raw",24.3,1.9,48.8,297,44.5,1.2,0.0, "Legumes"
"Lentils, red, split, dried, boiled in unsalted water",8.1,0.7,16.9,102,16.5,0.4,0.0, "Legumes"
"Lentils, red, split, dried, raw",25.6,1.8,51.2,311,49.9,1.3,0.0, "Legumes"
"Lettuce, average, raw",1.2,0.1,1.4,11,Tr,1.4,0.0, "Vegetables"
"Lime juice cordial, diluted",Tr,0.0,6.0,22,0.0,6.0,0.0, "Beverages"
"Lime juice cordial, undiluted",0.1,0.0,29.8,112,Tr,29.8,0.0, "Beverages"
"Lime juice, fresh",0.4,0.1,1.6,9,0.0,1.6,0.0, "Beverages"
"Limes, flesh only",0.7,0.3,0.8,9,0.0,0.8,0.0, "Fruits"
"Limes, flesh only, weighed with peel and pips",0.5,0.2,0.6,6,0.0,0.6,0.0, "Fruits"
"Ling, raw",18.8,0.7,0.0,82,0.0,0.0,N, "Seafood"
"Liqueurs, cream",3.0,13.0,21.8,305,Tr,21.8,N, "Beverages"
"Liqueurs, high strength",Tr,0.0,24.4,314,0.0,24.4,0.0, "Beverages"
"Liqueurs, low-medium strength",Tr,0.0,32.8,262,0.0,32.8,0.0, "Beverages"
Liquorice allsorts,3.7,5.2,76.7,349,9.4,62.4,0.0, "Sweets"
Liquorice powder,6.3,1.7,N,N,N,N,0.0, "Sweets"
"Liver and bacon, fried, homemade",28.9,14.7,Tr,247,Tr,0.0,332.8, "Meat"
"Liver and onions, stewed, homemade",14.7,6.9,5.4,142,Tr,4.3,297.2, "Meat"
Liver sausage,13.4,16.7,6.0,226,5.0,1.0,115.0, "Meat"
"Liver, calf, fried in corn oil",22.3,9.6,Tr,176,0.0,0.0,330.0, "Meat"
"Liver, calf, raw",18.3,3.4,Tr,104,0.0,0.0,370.0, "Meat"
"Liver, chicken, fried in corn oil",22.1,8.9,Tr,169,0.0,0.0,350.0, "Poultry"
"Liver, chicken, raw",17.7,2.3,Tr,92,0.0,0.0,380.0, "Poultry"
"Liver, lamb, fried in corn oil",30.1,12.9,Tr,237,0.0,0.0,400.0, "Meat"
"Liver, lamb, raw",20.3,6.2,Tr,137,0.0,0.0,430.0, "Meat"
"Liver, ox, raw",21.1,7.8,Tr,155,0.0,0.0,270.0, "Meat"
"Liver, ox, stewed",24.8,9.5,3.6,198,3.6,Tr,240.0, "Meat"
"Liver, pig, raw",21.3,3.1,Tr,113,0.0,0.0,260.0, "Meat"
"Liver, pig, stewed",25.6,8.1,3.6,189,3.6,0.0,290.0, "Meat"
"Lobster, boiled",22.1,1.6,Tr,103,Tr,Tr,110.0, "Seafood"
"Lobster, boiled, weighed with shell",8.0,0.6,Tr,37,Tr,Tr,40.0, "Seafood"
"Loganberries, raw",1.1,Tr,3.4,17,0.0,3.4,0.0, "Fruits"
"Loganberries, stewed with sugar",0.8,Tr,12.5,50,0.0,12.5,0.0, "Fruits"
"Loganberries, stewed without sugar",0.9,Tr,2.9,14,0.0,2.9,0.0, "Fruits"
"Lollies, containing ice-cream",1.4,3.8,20.9,118,0.0,20.9,4.1, "Sweets"
"Lollies, with real fruit juice",0.1,0.3,18.6,73,0.0,17.8,N, "Sweets"
"Longans, canned in syrup, drained",0.4,0.3,17.1,67,0.1,17.0,0.0, "Fruits"
"Longans, canned in syrup, whole contents",0.3,0.2,16.5,63,0.1,16.4,0.0, "Fruits"
"Longans, flesh only, dried",4.9,0.4,72.0,286,0.5,71.5,0.0, "Fruits"
"Loquats, flesh only, raw",0.7,0.2,6.3,28,0.0,6.3,0.0, "Fruits"
"Lotus tubers, raw",2.1,0.1,11.0,51,5.5,5.5,0.0, "Vegetables"
Lucozade,Tr,0.0,16.0,60,Tr,11.1,0.0, "Beverages"
"Luncheon meat, Chinese, steamed",11.9,22.3,10.5,288,N,N,N, "Meat"
"Lychees, flesh only, raw, weighed with skin and stone",0.5,0.1,8.9,36,0.0,8.9,0.0, "Fruits"
"Lychees, raw, flesh only",0.9,0.1,14.3,58,0.0,14.3,0.0, "Fruits"
"Macadamia nuts, salted",7.9,77.6,4.8,748,0.8,4.0,0.0, "Nuts and Seeds"
"Macaroni cheese, homemade",7.8,8.6,19.8,183,16.9,2.8,16.9, "Dairy"
"Macaroon, homemade",9.9,17.8,64.0,442,4.1,62.0,0.0, "Bakery"
"Mace, ground",6.7,32.4,N,N,N,N,0.0, "Herbs and Spices"
"Mackerel, flesh only, grilled",20.3,22.4,0.0,283,0.0,0.0,75.0, "Seafood"
"Mackerel, flesh only, grilled, fillets weighed with bones and skin",19.9,22.0,0.0,278,0.0,0.0,73.5, "Seafood"
"Mackerel, flesh only, raw",18.0,17.9,0.0,233,0.0,0.0,60.0, "Seafood"
"Mackerel, flesh only, smoked",21.1,24.1,0.0,301,0.0,0.0,63.0, "Seafood"
Maltesers and similar products,7.6,23.3,63.0,476,7.5,55.5,11.7, "Sweets"
"Mammie apple, flesh only",0.5,0.4,14.4,60,Tr,14.4,0.0, "Fruits"
"Mandarin oranges, canned in juice, whole contents",0.7,Tr,7.7,32,0.0,7.7,0.0, "Fruits"
"Mango, unripe, green flesh, raw",0.5,0.2,11.2,46,5.6,5.6,0.0, "Fruits"
"Mangoes, ripe, flesh only, raw",0.7,0.6,10.7,48,0.3,10.4,0.0, "Fruits"
"Mangoes, ripe, flesh only, raw, weighed with skin and stone",0.4,0.4,6.7,30,0.2,6.5,0.0, "Fruits"
"Mangosteen, flesh only",0.6,0.5,16.4,73,0.3,16.1,0.0, "Fruits"
"Marjoram, dried",12.7,7.0,42.5,271,N,N,0.0, "Herbs and Spices"
Marmalade,0.1,0.0,69.5,261,0.0,69.5,0.0, "Miscellaneous"
"Marrow, boiled in unsalted water",0.4,0.2,1.6,9,0.2,1.4,0.0, "Vegetables"
"Marrow, parwal, raw",1.6,Tr,2.1,14,1.3,0.8,0.0, "Vegetables"
"Marrow, raw",0.5,0.2,2.2,12,0.1,2.1,0.0, "Vegetables"
Mars bar and own brand equivalents,4.1,15.3,66.6,404,3.3,63.3,9.7, "Sweets"
Marshmallows,3.9,0.0,83.1,327,4.5,64.5,0.0, "Sweets"
"Marzipan, homemade",10.4,25.7,50.1,460,1.5,48.7,26.1, "Sweets"
"Marzipan, white and yellow, retail",5.3,12.7,67.6,389,0.0,67.6,0.0, "Sweets"
"Matoki, boiled in unsalted water",1.3,0.2,22.3,91,21.7,0.6,0.0, "Grains and Flours"
"Matoki, raw",1.2,0.2,22.3,90,21.5,0.9,0.0, "Grains and Flours"
"Mayonnaise, homemade",1.7,84.2,0.1,786,0.0,0.1,44.0, "Sauces and Condiments"
"Mayonnaise, reduced fat",1.0,28.1,8.2,288,3.6,4.6,21.7, "Sauces and Condiments"
"Mayonnaise, standard, retail",1.1,74.8,2.4,686,Tr,2.4,57.2, "Sauces and Condiments"
"Mchicha, homemade",3.6,4.7,4.0,73,0.1,3.0,0.0, "Vegetarian"
"Meat loaf, homemade",16.6,10.9,12.7,213,10.7,1.5,70.4, "Meat"
"Meat samosas, takeaway",11.4,17.3,18.9,272,16.8,1.9,19.7, "Meat"
Meat spread,15.7,13.4,2.3,192,2.1,0.2,62.0, "Meat"
"Meatballs, pork and beef, in tomato sauce, homemade",10.0,7.2,4.6,123,1.6,2.8,41.4, "Meat"
"Medlars, flesh only",0.5,Tr,10.6,42,0.0,10.6,0.0, "Fruits"
Melon seeds,28.5,47.7,9.9,583,N,N,0.0, "Nuts and Seeds"
"Melon, Canteloupe-type, flesh only",0.6,0.1,4.2,19,0.0,4.2,0.0, "Fruits"
"Melon, Canteloupe-type, flesh only, weighed whole",0.4,0.1,2.5,12,0.0,2.5,0.0, "Fruits"
"Melon, Canteloupe-type, flesh only, weighed with skin",0.4,0.1,2.8,13,0.0,2.8,0.0, "Fruits"
"Melon, flesh only, average",0.5,0.1,5.5,24,0.0,5.5,0.0, "Fruits"
"Melon, flesh only, average, weighed whole",0.3,0.1,3.5,15,0.0,3.5,0.0, "Fruits"
"Melon, flesh only, average, weighed with skin",0.3,0.1,3.7,16,0.0,3.7,0.0, "Fruits"
"Melon, Galia, flesh only",0.5,0.1,5.6,24,0.0,5.6,0.0, "Fruits"
"Melon, Galia, flesh only, weighed whole",0.3,0.1,3.6,16,0.0,3.6,0.0, "Fruits"
"Melon, Galia, flesh only, weighed with skin",0.3,0.1,3.8,16,0.0,3.8,0.0, "Fruits"
"Melon, Honeydew, flesh only, weighed whole",0.3,0.1,4.0,17,0.0,4.0,0.0, "Fruits"
"Melon, Honeydew, flesh only, weighed with skin",0.3,0.1,4.3,18,0.0,4.3,0.0, "Fruits"
"Melon, watermelon, flesh only",0.5,0.3,7.1,31,0.0,7.1,0.0, "Fruits"
"Melon, watermelon, flesh only, weighed whole",0.3,0.2,4.0,18,0.0,4.0,0.0, "Fruits"
"Melon, yellow flesh, flesh only",0.5,0.1,6.8,29,0.0,6.8,0.0, "Fruits"
"Meringue, homemade",6.3,Tr,96.0,385,0.0,96.0,0.0, "Bakery"
"Meringue, with cream, homemade",2.9,24.2,27.2,331,0.0,27.2,63.0, "Bakery"
"Methi aloo, homemade",2.7,10.4,10.1,142,8.6,1.5,4.7, "Vegetarian"
"Milk bread, homemade",8.8,7.0,50.8,289,48.7,2.1,3.1, "Bakery"
"Milk drink, fermented, with probiotics",3.0,1.2,12.7,70,0.4,12.3,N, "Dairy"
"Milk shake, powder",1.3,1.6,98.3,388,Tr,98.3,Tr, "Beverages"
"Milk shake, powder, made up with semi-skimmed milk",3.3,1.7,11.2,70,Tr,11.2,5.5, "Beverages"
"Milk shake, powder, made up with skimmed milk",3.3,0.3,11.3,59,Tr,11.3,3.4, "Beverages"
"Milk shake, powder, made up with whole milk",3.3,3.5,11.1,86,Tr,11.1,11.2, "Beverages"
"Milk, 1% fat, pasteurised",3.5,1.0,4.8,41,0.0,4.8,4.8, "Dairy"
"Milk, Channel Islands, whole, pasteurised",3.5,4.7,4.3,72,0.0,4.3,15.9, "Dairy"
"Milk, Channel islands, whole, summer",3.9,4.7,4.1,73,0.0,4.1,16.0, "Dairy"
"Milk, Channel islands, whole, winter",3.2,4.7,4.4,72,0.0,4.4,15.7, "Dairy"
"Milk, condensed, whole, sweetened",   7.4,8.0,55.5, 310,0.0,55.5,29.0, "Dairy"
"Milk, evaporated, light",7.8,4.1,10.3,107,0.0,10.3,16.9, "Dairy"
"Milk, evaporated, whole",8.4,9.4,  12.7, 166,0.0,  12.7,34.0, "Dairy"
"Milk, flavoured, pasteurised, chocolate",3.6,1.5,  11.7,  72,0.3,  11.0,7.0, "Dairy"
"Milk, flavoured, pasteurised, strawberry, banana",3.6,1.5,9.6,64,0.2,8.9,7.0, "Dairy"
"Milk, goats, pasteurised",3.1,3.7,4.4,62,0.0,4.4,11.0, "Dairy"
"Milk, human, colostrum",2.0,2.6,6.6,56,0.0,6.6,31.0, "Dairy"
"Milk, human, mature",1.3,4.1,7.2,69,0.0,7.2,16.0, "Dairy"
"Milk, human, transitional",1.5,3.7,6.9,67,0.0,6.9,24.0, "Dairy"
"Milk, semi-skimmed, pasteurised, average",3.5,1.7,4.7,46,0.0,4.7,5.9, "Dairy"
"Milk, semi-skimmed, pasteurised, summer and autumn",3.5,1.7,4.5,46,0.0,4.5,6.0, "Dairy"
"Milk, semi-skimmed, pasteurised, winter and spring",3.4,1.7,4.9,47,0.0,4.9,5.7, "Dairy"
"Milk, semi-skimmed, UHT",3.3,1.6,4.9,46,0.0,4.9,7.0, "Dairy"
"Milk, sheeps, raw",5.4,5.8,5.1,93,0.0,5.1,12.0, "Dairy"
"Milk, skimmed, dried, fortified",36.1,0.6,52.9,348,0.0,52.9,12.0, "Dairy"
"Milk, skimmed, pasteurised, average",3.5,0.3,4.8,34,0.0,4.8,3.7, "Dairy"
"Milk, skimmed, pasteurised, summer",3.5,0.2,4.4,32,0.0,4.4,2.6, "Dairy"
"Milk, skimmed, pasteurised, winter",3.5,0.2,4.2,32,0.0,4.2,4.1, "Dairy"
"Milk, skimmed, UHT",3.4,0.1,4.9,33,0.0,4.9,2.0, "Dairy"
"Milk, soya, non-dairy alternative to milk, sweetened, fortified",3.1,2.4,2.5,43,0.0,2.2,0.0, "Dairy"
